temps_id,id_dossier,id_avocat,nom_avocat,date_prestation,description,heures,taux_horaire,facture_id
c3c83bf3-8049-4ae0-b0da-a9b8011866db,8a31273e-23eb-4904-b9df-c1fea644ed08,99f39dfa-f1e2-4ec1-be06-d65859789f1f,Alexandre Traore,2022-12-04,Crier ailleurs réalité goût détacher.,0.5,220,
194f466d-a11d-4c64-9bd2-174ca29dc7bc,4a35432a-d5f4-4f25-aed1-c11a4d72b6d6,4d1333a4-d0c7-4c36-9580-2a400135c126,Victor du Vasseur,2023-12-01,Chanter dont avouer son humain.,2.0,300,24ebeb33-d60d-4d66-8638-1bd83621e190
6382be71-1469-4bdd-8e1c-a4d7632d0bd5,11400748-cd6e-4a60-a8dc-b8ccfaf13cb7,495caabb-57b9-4f6c-a1a0-256d5fc15acf,Denis-Franck Ledoux,2025-03-10,Croix suivant connaître art supérieur grandir ventre effet coucher trente.,1.0,300,
89366b90-9854-4825-8c11-3e782acd258c,367d9f2d-0a86-4c08-b036-372639a512f7,a9f97ea4-2b30-4b38-a641-ccf0a35c99c1,Gérard-Frédéric Joly,2025-05-03,Mari répéter verre haïr tendre montrer saint miser suivre.,2.0,180,
c1aeebf0-3d14-45f4-bcf3-ddc534d33a35,84a94905-8226-4fec-965c-f570e03e334e,4d1333a4-d0c7-4c36-9580-2a400135c126,Victor du Vasseur,2024-02-17,Profiter naissance chasse pièce saint.,0.5,250,bcfaf2b3-4c27-4d92-a0a5-527909c08f62
95561707-dd83-4bca-b021-ccae938a3620,545b783a-2080-4167-ad84-2651e2342fb5,0ee105d0-7745-4c96-bbf0-3df65bd210ab,Marcel Leblanc,2025-04-25,Adresser supposer tracer lever engager respecter pleurer direction.,1.0,180,
86af32ba-f052-477f-8327-0a58c6d309c5,b5c03709-2a38-4f91-a166-e6648c8a42cd,d0be7ecc-0745-4454-a3cc-2d2868b6b3d8,Aurore Maury-Briand,2022-11-02,Trésor signer particulier passage naissance année queue construire poussière.,1.5,300,
fefd1f3d-6dd8-4dd5-a2b1-2432bf432983,5ef07712-af0d-4cb3-b1e8-dea4a4580a29,4d1333a4-d0c7-4c36-9580-2a400135c126,Victor du Vasseur,2023-10-18,Fermer étouffer un vide mur affaire roman afin de supposer lien.,1.5,300,
7b91bb4f-a1f9-4f03-93b2-12dfb54baecd,b3a3932e-0a68-41ff-898f-05d25f59b9a8,fba0cbe6-1a09-4487-946b-d85567269b04,Laurence Robert,2023-03-13,Peine image fuir étroit meilleur maintenant réel calme composer.,0.5,220,
a9417d23-d8e5-4e42-9dc7-8dbfcabec8e1,c102b141-a882-4db1-8f7b-061fa3909fe6,4d1333a4-d0c7-4c36-9580-2a400135c126,Victor du Vasseur,2024-03-01,Comprendre nourrir meilleur figure sentier portier hasard droit.,0.5,250,
ef8d2c38-8dd3-4945-b312-a3f7929c4ed4,c43cfe86-737c-4c21-9a89-b9ea98543080,52fc2f51-6484-441d-a3ac-19515cc8485f,Yves Traore,2024-07-11,Voyage riche bouche pencher où.,0.25,180,
c40b3754-e529-44e6-8c62-18b203cc6ced,33c2409d-4c78-4c01-829d-ec90310d94b2,fba0cbe6-1a09-4487-946b-d85567269b04,Laurence Robert,2025-06-20,Lentement ramener toucher boire hier.,1.5,220,783aa2bf-7f24-4c9f-9043-24280e9c2ed9
2d7f5105-3be6-4a78-8395-63ee04e662c8,3ba4c7d7-5a41-486e-8bef-3fe7e7c59a05,495caabb-57b9-4f6c-a1a0-256d5fc15acf,Denis-Franck Ledoux,2025-01-20,Seul crier remplacer mesure calmer sien tuer.,1.5,220,
1bc993e6-307f-4125-8f81-2fd46da96ba6,c8986a69-d97e-4f85-a9a3-f1d85d927eb2,0ee105d0-7745-4c96-bbf0-3df65bd210ab,Marcel Leblanc,2024-03-08,Gagner ruine préparer que accord femme de droit souffrance.,1.5,300,
ed51846c-0f42-4e2a-adf9-3c87648617ce,676d8d9b-7605-46f5-bbff-22f0b7c81b28,4d1333a4-d0c7-4c36-9580-2a400135c126,Victor du Vasseur,2025-04-07,Secret résultat garder depuis système garder affirmer.,2.0,180,
658361c3-e10f-4339-9eee-40de49f04ddd,2894aa01-a22f-4204-afd5-5ab69df9ca1a,0ee105d0-7745-4c96-bbf0-3df65bd210ab,Marcel Leblanc,2024-12-19,Sein lutte que ennemi commencer mort gris milieu.,1.0,300,
08a8a93b-771d-480e-9d28-2d3059eb2585,1b08e87f-ec7c-48b6-88e9-bfa9c62e2a81,57bf8456-f58d-41c6-afc3-2e24e3b187b4,Gabriel de Guilbert,2023-04-25,Où fond arrière tout grave travailler.,0.25,180,
eacf44b3-b7f0-4cb1-934c-fc3a63fdd7ae,df65f114-c111-4815-a52e-37c3cf451607,a9f97ea4-2b30-4b38-a641-ccf0a35c99c1,Gérard-Frédéric Joly,2024-12-31,Français énorme cinq défendre presser celui.,2.0,300,
f6437d27-4f05-4ae4-aab5-4c291bb58273,c2b04ca8-21a2-4b09-846e-846f4ea91d9a,52fc2f51-6484-441d-a3ac-19515cc8485f,Yves Traore,2023-05-04,Mur folie reconnaître terre secours cinquante entourer bête ajouter achever regretter.,2.0,250,
5511c8df-15af-4972-a237-c60aa9d3613e,c2b04ca8-21a2-4b09-846e-846f4ea91d9a,0ee105d0-7745-4c96-bbf0-3df65bd210ab,Marcel Leblanc,2023-06-27,Ouvert mêler vie mort air.,2.0,180,e82d1b60-1b45-444b-973c-c536c9d019c2
9974fdbd-7da0-4e69-a4d8-be9201f4ff42,0d2db5a4-367a-4f1c-a4e0-acde143d5957,495caabb-57b9-4f6c-a1a0-256d5fc15acf,Denis-Franck Ledoux,2025-01-31,Vite particulier remplir consentir pensée d'autres.,1.0,180,
29c077ed-b654-497a-b073-12536772a006,6e6176c0-f267-4ad2-b06f-cf818f9ceea1,99f39dfa-f1e2-4ec1-be06-d65859789f1f,Alexandre Traore,2022-06-04,Seigneur promettre rideau fête difficile arrière banc charger ailleurs vivre.,1.5,300,
b4469b60-f450-4712-9277-9e2fbf47746d,435ed83c-bb7e-465c-b4aa-287d9d1e6957,495caabb-57b9-4f6c-a1a0-256d5fc15acf,Denis-Franck Ledoux,2024-12-27,Important nouveau briser dresser sujet.,1.0,300,
3cc9cde7-81a8-4d0c-9e44-b8d3837b927b,9f1536ed-7682-4baf-b712-a636e5d0bef7,2cb6b053-969a-40a2-a054-223a2f3f11e1,Alexandre Morin,2024-06-17,Le expression secret foi justice.,0.5,180,
a7db0579-e943-45fa-9078-a025c1f7a61a,ff0c6248-ed13-4f38-b725-27842abfb457,495caabb-57b9-4f6c-a1a0-256d5fc15acf,Denis-Franck Ledoux,2025-03-19,Autrefois vaste avant porte fenêtre enfant te rire.,1.0,180,
200c9c6f-1075-473a-b8d4-191713ebe8dd,8a31273e-23eb-4904-b9df-c1fea644ed08,52fc2f51-6484-441d-a3ac-19515cc8485f,Yves Traore,2022-10-13,Accuser conclure monde oeuvre amuser vif votre.,2.0,180,
ebcb4e1e-17c2-48fb-acfa-ffb005d21e8b,4a35432a-d5f4-4f25-aed1-c11a4d72b6d6,495caabb-57b9-4f6c-a1a0-256d5fc15acf,Denis-Franck Ledoux,2025-03-23,Obéir accent magnifique devant cause oeuvre mari lune réclamer curieux façon.,0.25,250,
02579fb7-be1d-467c-8d2d-42ccb57a0b58,c43cfe86-737c-4c21-9a89-b9ea98543080,0ee105d0-7745-4c96-bbf0-3df65bd210ab,Marcel Leblanc,2022-10-24,Envie dangereux propos travers distance.,0.25,250,
201f8d06-3f20-4978-b240-2ad875777c31,c07fb20c-e320-4e66-a10d-0e8a24c3b869,2cb6b053-969a-40a2-a054-223a2f3f11e1,Alexandre Morin,2024-07-13,Un étrange mesure écouter question lendemain.,1.0,180,
04afe710-03e3-457f-841b-99dafda186de,b3a3932e-0a68-41ff-898f-05d25f59b9a8,495caabb-57b9-4f6c-a1a0-256d5fc15acf,Denis-Franck Ledoux,2024-11-05,Toile désormais couche sentiment principe venir bord ressembler.,0.5,300,
24aec580-3d9d-44f3-a0d7-64d4b5c6ecd1,b3a3932e-0a68-41ff-898f-05d25f59b9a8,2cb6b053-969a-40a2-a054-223a2f3f11e1,Alexandre Morin,2025-03-01,Colon course professeur habiller homme nouveau dominer.,0.5,300,599b7f6f-96bb-46b7-9a75-1c255e57f505
94fc7b81-b10b-41d5-ade1-5226723762be,6647595d-50c1-4043-a220-0f5f2c6d7525,a9f97ea4-2b30-4b38-a641-ccf0a35c99c1,Gérard-Frédéric Joly,2023-04-29,Bruit fille couler étude sur route hôtel subir valeur détail fuir.,0.5,220,
949369d5-0c4f-498f-826d-d551db19d987,c4a1c050-32ab-4517-a48a-940bc6dc7edf,4d1333a4-d0c7-4c36-9580-2a400135c126,Victor du Vasseur,2025-06-17,Fort calmer rire grave conseil dès cruel faute.,0.5,300,
ea8971bf-0d7c-4140-bb83-9895258553d9,87d0ddf5-77c4-4f8c-84c0-1fc9ea226e41,d0be7ecc-0745-4454-a3cc-2d2868b6b3d8,Aurore Maury-Briand,2023-05-17,Causer énorme acheter envoyer inspirer résultat surprendre mode.,2.0,250,b394a4c1-530a-4532-8019-2ba7d328b171
7c67cf56-2a16-4a15-b21e-e60a367d21d9,852e0a6d-857f-468b-bcec-6f38a233264a,99f39dfa-f1e2-4ec1-be06-d65859789f1f,Alexandre Traore,2024-10-06,Obliger mal bord douleur offrir sourd simple.,0.5,300,
9b84942d-f634-4050-a3b4-88d030a2c78b,ff0c6248-ed13-4f38-b725-27842abfb457,fba0cbe6-1a09-4487-946b-d85567269b04,Laurence Robert,2025-03-29,Suivant glisser rapporter ennemi ensuite cou révéler leur voiture glace.,2.0,220,
88a0cfa9-7b7a-4584-94b7-ea81bfd6a0f0,a2f8336d-9fa5-4feb-a147-9bea04d1b010,fba0cbe6-1a09-4487-946b-d85567269b04,Laurence Robert,2024-12-03,Comment envelopper fil muet droite pauvre sien voir temps.,1.0,220,
e9369ee0-d5aa-496a-8c80-a67de4313506,478ddbef-c815-4bf6-b821-65f2bb0b6c0a,99f39dfa-f1e2-4ec1-be06-d65859789f1f,Alexandre Traore,2024-04-18,Selon franc supporter terrible apparence pauvre.,1.0,300,
ad188549-806f-42e0-bfb0-a5a391751f91,f24d314f-7164-4d41-ab19-5da9a7545fd8,0ee105d0-7745-4c96-bbf0-3df65bd210ab,Marcel Leblanc,2025-05-25,Bientôt révéler profond dormir rapide fou militaire enfance or.,0.25,180,
2acfbb36-af8c-4db0-8851-bb01cc1a80ce,d3343d66-4502-44a3-878e-4f896dd3fd90,4d1333a4-d0c7-4c36-9580-2a400135c126,Victor du Vasseur,2025-04-21,Poussière il sérieux vers cause faveur ouvert.,2.0,250,
b3f67bc9-0a12-4d81-9ada-5d18edd7beaa,dd66d9ff-2cb9-4001-b6ba-d50c6db32d2e,a9f97ea4-2b30-4b38-a641-ccf0a35c99c1,Gérard-Frédéric Joly,2022-02-18,Argent acheter branche entraîner porter habitude commencement.,1.0,300,
51b0a93d-5669-4f85-a42b-67f99229f2b5,7b45d1aa-eabb-411d-a194-e0ecfbe6e782,495caabb-57b9-4f6c-a1a0-256d5fc15acf,Denis-Franck Ledoux,2025-03-28,Rose marier accent portier arrivée sourd apporter arme.,0.5,250,
813591fe-4700-4165-9200-556bdf541f32,d50de8ff-16e9-4d43-9f15-b0b4160b3b75,57bf8456-f58d-41c6-afc3-2e24e3b187b4,Gabriel de Guilbert,2023-04-08,Diriger porter respecter feuille précéder.,2.0,180,
4b3571f2-eb69-42bd-9afc-ecd088a6050b,843a9872-f627-46be-93a6-67a7a4742534,99f39dfa-f1e2-4ec1-be06-d65859789f1f,Alexandre Traore,2022-09-26,Imposer celui six rang souvenir vers garçon honneur causer malade.,1.5,180,
f07b76ec-ea40-4d0b-946f-ce39d1990cfd,1a1f3ea6-0bf9-4d2a-befa-49d35c6d1d67,57bf8456-f58d-41c6-afc3-2e24e3b187b4,Gabriel de Guilbert,2025-06-10,Peu village entier public début diriger effacer banc mince.,0.5,250,9f0c9757-5ab3-4958-941d-07c562b67465
f2223522-c5b0-48c3-9112-c65f304b748b,38e3550b-3272-4de0-ab86-e4d02923f1ad,495caabb-57b9-4f6c-a1a0-256d5fc15acf,Denis-Franck Ledoux,2023-02-15,Pourtant avance léger crise plan intelligence.,0.25,180,
b9b6e293-127a-48b0-9694-ac28632c9f37,2e469faf-03f8-44f4-b0c9-b787d01e2e0e,495caabb-57b9-4f6c-a1a0-256d5fc15acf,Denis-Franck Ledoux,2025-02-06,Journée étage rompre recommencer lourd enfant.,0.25,180,9bf52795-a9f2-4357-b3cf-c515a594a681
31801c7e-0063-4a07-90fe-1fadbcaac1e6,3a2c9f07-e085-4ce2-9a4c-4f7c1781d67e,495caabb-57b9-4f6c-a1a0-256d5fc15acf,Denis-Franck Ledoux,2025-03-21,Permettre sept bras certain terre fin ici pain courage.,0.5,180,
1862a318-d8a0-4f45-96a8-cabaee6cf49d,7a68a2db-206c-463a-874c-ce554fc5103b,2cb6b053-969a-40a2-a054-223a2f3f11e1,Alexandre Morin,2024-06-23,Aussitôt goût port un mur bonheur.,1.5,180,
8f765f2e-4f0f-4fc6-a8bc-4fd826b1b863,11cb12b7-6500-4cf7-8cdf-0d93efb55921,4d1333a4-d0c7-4c36-9580-2a400135c126,Victor du Vasseur,2024-08-26,Question dépasser sujet considérer âme.,1.0,250,7a91a0ea-961f-4298-9e9e-f3c13a597e8d
4968be7d-d1a7-4b91-aa0d-2405f2adfccd,11cb12b7-6500-4cf7-8cdf-0d93efb55921,99f39dfa-f1e2-4ec1-be06-d65859789f1f,Alexandre Traore,2025-07-04,Ici discuter toucher bande groupe cheval lien livrer arriver donc.,1.5,300,
60df51da-e0c4-4b81-9294-8c36c40e3bc2,f7bf44a5-d389-47da-97b5-2092817aed72,2cb6b053-969a-40a2-a054-223a2f3f11e1,Alexandre Morin,2022-02-26,Peine puis gloire école franc.,1.0,220,
de8694d7-d3cf-4d61-8fe6-b95f0c3e6d04,af518df3-f84d-438d-9966-aecc0d0ddc4d,d0be7ecc-0745-4454-a3cc-2d2868b6b3d8,Aurore Maury-Briand,2025-05-28,Malheur le habiller point pays vaste dangereux.,2.0,300,45d818ff-79ee-4033-b019-dd168edd85ae
6325fbf1-54e1-4285-a55e-a65311331640,6949b152-88ab-4e80-a025-1562745e70ee,52fc2f51-6484-441d-a3ac-19515cc8485f,Yves Traore,2025-03-12,Moyen dent manquer dos source.,2.0,300,128eb4eb-e154-4a93-9b48-a0af5eb69166
46f3b66b-fff9-4084-bb42-1f31b9f9914c,c96ec555-0999-48ab-bfbb-b7d191d53cab,2cb6b053-969a-40a2-a054-223a2f3f11e1,Alexandre Morin,2024-07-27,Fonction dangereux saisir poste léger comment courant parvenir.,0.25,180,10d59af3-b2ff-486f-be2b-0a95f627c234
5b4790c3-c704-414b-9415-114971275efc,7a68a2db-206c-463a-874c-ce554fc5103b,fba0cbe6-1a09-4487-946b-d85567269b04,Laurence Robert,2025-02-16,Durer absence conscience te palais quart seulement porter commencement point.,0.25,300,b9b210ff-a373-4969-9a5f-a631042e6a90
6f377ae2-8562-47fa-a3e0-590ab31db4e6,545b783a-2080-4167-ad84-2651e2342fb5,99f39dfa-f1e2-4ec1-be06-d65859789f1f,Alexandre Traore,2024-09-16,Erreur île venir pitié grand aide.,1.5,250,bb746165-e85f-4cbf-a367-b2eeab7862a7
5d59a0b7-ea44-460a-be0d-cd0496e783ce,383e47f4-9dc5-4c97-8959-a35de338f901,495caabb-57b9-4f6c-a1a0-256d5fc15acf,Denis-Franck Ledoux,2023-03-28,Commencer recherche accuser étroit inutile.,0.25,300,
11dc89f1-fd58-4f3e-bfe6-e7ae63668716,f50bd7ff-92c5-475c-beb3-43a17eeeb377,a9f97ea4-2b30-4b38-a641-ccf0a35c99c1,Gérard-Frédéric Joly,2021-12-14,Son interroger après âge poids écarter déclarer lier rappeler.,2.0,220,6f275fff-34dd-42a8-ac39-89a8011d9fd9
f1a6d6b8-9935-485c-b1cb-42bd53675ded,e803fded-e227-45c0-86a9-41496eeceae3,495caabb-57b9-4f6c-a1a0-256d5fc15acf,Denis-Franck Ledoux,2022-10-25,Émotion qualité ici puissant voiture.,2.0,250,
f11a3bb8-4021-497e-8327-c5dfb800f56f,ff0c6248-ed13-4f38-b725-27842abfb457,4d1333a4-d0c7-4c36-9580-2a400135c126,Victor du Vasseur,2025-05-03,Détruire importance sans élever espace lune pièce soin sembler.,0.25,180,
07b925a5-93a6-435e-96a7-f875b00bf333,6647595d-50c1-4043-a220-0f5f2c6d7525,a9f97ea4-2b30-4b38-a641-ccf0a35c99c1,Gérard-Frédéric Joly,2024-01-11,Dix lutter passé chemin fuir.,1.5,250,
96355f9a-2f16-4d1b-a3c9-e6a3aa8329a3,0a5f032e-0484-49a5-81be-b3859161ef05,0ee105d0-7745-4c96-bbf0-3df65bd210ab,Marcel Leblanc,2025-05-14,Exiger amuser musique pousser gros court.,0.25,300,
513dae55-befc-4e68-a78a-132cc0e496e1,11400748-cd6e-4a60-a8dc-b8ccfaf13cb7,4d1333a4-d0c7-4c36-9580-2a400135c126,Victor du Vasseur,2024-06-26,Tirer fête bruit dont parcourir même.,0.25,250,
f4c35a92-9900-4429-8a62-cb74012465db,912ca562-b49e-4fc1-af18-545ace7d1fcc,d0be7ecc-0745-4454-a3cc-2d2868b6b3d8,Aurore Maury-Briand,2025-01-12,Complet témoin étranger éprouver nom trois double contenter nation premier.,0.5,180,d7848584-c38f-4730-a3ed-8f55ac794b3c
9c83f65a-263a-4e89-91dc-971325b56a03,af518df3-f84d-438d-9966-aecc0d0ddc4d,4d1333a4-d0c7-4c36-9580-2a400135c126,Victor du Vasseur,2025-07-13,Ce résultat mon respirer étonner but accorder toucher chef point maintenant.,0.25,250,
530d30a7-b6d5-4145-8fa8-a1058abca645,a59ce143-58b4-4d0f-aab8-c6fc169f1105,99f39dfa-f1e2-4ec1-be06-d65859789f1f,Alexandre Traore,2024-08-28,Mince clef journal aucun écouter ignorer curiosité salle ce juge accent.,0.25,250,3342f3ff-6df8-4dea-87eb-40a3edc7f1a9
8b002e77-6f59-4045-97d8-f0a649be6f05,ec184383-99d6-4bf4-9ad4-fd7dd113b9d2,4d1333a4-d0c7-4c36-9580-2a400135c126,Victor du Vasseur,2023-09-17,Armer chambre souffler reposer.,0.25,220,
61ecf061-488a-4b71-a025-2903169508df,4c479ea5-5830-43b3-a98a-022c2eba90c1,fba0cbe6-1a09-4487-946b-d85567269b04,Laurence Robert,2025-06-01,Choix bas docteur voyager côté neuf avoir dame interrompre éviter.,2.0,220,
27e40a36-7d3d-4938-a980-759f60ed29e1,e8bf4353-788a-4115-852c-00140a9d4527,a9f97ea4-2b30-4b38-a641-ccf0a35c99c1,Gérard-Frédéric Joly,2025-07-21,Gloire vers bleu digne elle endormir moins poésie.,0.25,220,
369d46a2-09d7-48c5-bd37-3faccced5ea1,32da7216-fddc-4c53-bb9f-79e5d7c19e0d,fba0cbe6-1a09-4487-946b-d85567269b04,Laurence Robert,2024-07-09,Chance regard désormais gauche couler émotion effet toucher impossible connaissance.,2.0,180,32b80793-11cc-4c9a-aa04-08c8fecb74b5
630c66c3-4bf9-4002-a5ed-cc7f53e4c924,bdbf9d61-f0d3-4b6f-8120-fe05a48d84c3,52fc2f51-6484-441d-a3ac-19515cc8485f,Yves Traore,2025-07-20,Billet mal pourquoi lieu politique exiger événement instant vendre.,0.25,250,
7235bb2a-ac07-4df5-9ba4-8c2713ed21ac,f0719de2-682b-43fa-921e-2a98a54da4f6,fba0cbe6-1a09-4487-946b-d85567269b04,Laurence Robert,2024-11-14,Tendre aller refuser beau changer.,2.0,220,
7763b4d2-5f0f-4d77-a0a5-b0ea53c26220,aabd37b3-d214-4f66-bf6d-a323435a95e0,a9f97ea4-2b30-4b38-a641-ccf0a35c99c1,Gérard-Frédéric Joly,2023-11-02,Nature faux pain surveiller soudain art sentier.,0.25,300,
b831e03d-41e1-4f06-ac2e-0dbd2b4d1921,2d1cc68c-c65a-4064-8718-47f4f9607871,a9f97ea4-2b30-4b38-a641-ccf0a35c99c1,Gérard-Frédéric Joly,2022-10-21,Plaisir inconnu recueillir lune secret barbe dix voie.,0.5,300,
38c41c66-c646-4653-846e-fd7248a83b72,f4ae22ce-607d-429e-af02-92cb70ad5efb,57bf8456-f58d-41c6-afc3-2e24e3b187b4,Gabriel de Guilbert,2022-02-13,Notre sac moitié posséder soi cause neuf long.,0.25,220,
8dcd1dad-bdba-4f69-a420-1f12d307d3ce,80feccbf-8f35-4dec-8a53-2ce879f745e3,99f39dfa-f1e2-4ec1-be06-d65859789f1f,Alexandre Traore,2024-11-08,Lumière mode verser chaise supérieur passé.,2.0,220,
4f23e8fc-3bab-4d05-8842-25b0a9afbade,d3be7f8e-fabe-4a9e-8b72-8663263a0655,2cb6b053-969a-40a2-a054-223a2f3f11e1,Alexandre Morin,2024-02-20,Parent prix traiter révolution papier coup auquel.,0.5,300,d1505a09-d2ff-4058-b945-ea1c9368e72c
a965c1d8-4351-434f-b9e0-183de4ea89bf,b8423ed1-64a8-4af3-942b-18e0c7ce3226,52fc2f51-6484-441d-a3ac-19515cc8485f,Yves Traore,2022-10-22,Souffrir lutter désespoir bouche air lisser foi ton eh joli.,1.5,220,
9f1e2f57-f804-41d2-a577-95aea38820cb,ec184383-99d6-4bf4-9ad4-fd7dd113b9d2,52fc2f51-6484-441d-a3ac-19515cc8485f,Yves Traore,2022-12-29,Selon mémoire sac point silencieux oui guerre.,0.25,300,
0bbd8175-38d7-4d28-9b6d-d139ca3eeaba,32da7216-fddc-4c53-bb9f-79e5d7c19e0d,fba0cbe6-1a09-4487-946b-d85567269b04,Laurence Robert,2023-03-30,Chanter quelqu'un dépasser longtemps précieux couleur.,0.25,180,32b80793-11cc-4c9a-aa04-08c8fecb74b5
38770447-460d-40f3-87b8-40fe2fc39b10,509d0159-970b-4e76-a0d8-5e785e9b30bd,4d1333a4-d0c7-4c36-9580-2a400135c126,Victor du Vasseur,2025-06-26,Eaux bois noire fait dos fine réunir.,1.5,220,df1210d8-176a-4af3-bf43-58150824adaf
54298ef1-6ecd-47d2-ba54-159d136855da,3cf05f82-1e8a-4f73-a5ce-baf9dd9191b0,0ee105d0-7745-4c96-bbf0-3df65bd210ab,Marcel Leblanc,2024-10-11,Roman chemin droit cas fleur nature anglais pendant personne.,1.5,300,1e201337-4e98-4919-a86c-6ccd622739d6
ae11a207-dda5-4247-8dcd-9f20de858141,72087a01-8cdc-4d3f-ace4-6b290abed523,495caabb-57b9-4f6c-a1a0-256d5fc15acf,Denis-Franck Ledoux,2025-01-21,Te éviter chance source importance.,0.5,300,
dc25e190-7b8a-4349-9d10-1d12e5c366d3,97ec3088-a469-4b66-91c0-3c1913d7a523,2cb6b053-969a-40a2-a054-223a2f3f11e1,Alexandre Morin,2023-12-09,Existence sien lier étrange présence foi.,1.0,300,869f5eab-160b-4fa3-b457-ea2ad8fc5adc
54d2c5da-84d3-4887-96a2-a9058137fdd5,ceeba2d5-ebc1-4e46-b739-10829fa683d2,a9f97ea4-2b30-4b38-a641-ccf0a35c99c1,Gérard-Frédéric Joly,2022-01-06,Permettre étroit prix établir prier reprendre.,2.0,180,
9fa6aff4-0e43-41a5-945f-f9f88b8d90d3,0d2db5a4-367a-4f1c-a4e0-acde143d5957,0ee105d0-7745-4c96-bbf0-3df65bd210ab,Marcel Leblanc,2024-02-12,Tombe aussi secrétaire joli vent oeil condition.,0.5,300,
3c90f6d8-6f51-4a07-9eac-76d3f140c8be,d51bdc64-5a8e-4e7a-83d7-b4f450018661,2cb6b053-969a-40a2-a054-223a2f3f11e1,Alexandre Morin,2025-07-17,Dieu pouvoir noire naturel neuf sauter auquel ami puis dégager.,0.25,220,f5701f15-d052-49de-9302-7e4cf21230d0
3743e55b-0b1e-4c8d-8fb3-683cf20624fc,a0628de8-7218-44d1-818e-0d574f9fed8f,fba0cbe6-1a09-4487-946b-d85567269b04,Laurence Robert,2025-05-19,Lever poète entre dégager relation.,0.5,220,
b14d5ce2-963a-4ee5-93ac-9f1e302a591b,5d10b768-3b3d-47f2-8d04-d2094e3781b7,99f39dfa-f1e2-4ec1-be06-d65859789f1f,Alexandre Traore,2024-10-22,Bras souhaiter proposer fils vieil toile attention.,1.0,250,e5f61347-dcc2-47ad-bff1-42ad2193a7f4
e7037195-db7d-40d9-b19a-dc27ba8ccfcb,8d0dbdd2-2104-4733-8d39-000e977627c3,495caabb-57b9-4f6c-a1a0-256d5fc15acf,Denis-Franck Ledoux,2025-01-12,Annoncer raconter herbe femme parmi.,1.5,180,6b749e24-378b-4207-8d1a-e79c36ed3bfe
bdbaeece-9de3-4d51-9667-6b1d1e114fa0,d78eaf42-d043-4eb4-9ed3-a7792c8d6808,52fc2f51-6484-441d-a3ac-19515cc8485f,Yves Traore,2023-10-15,Entendre précéder fête voisin mourir couleur.,0.5,180,
9c385c53-1296-490a-bbce-bf19df34d14c,852e0a6d-857f-468b-bcec-6f38a233264a,a9f97ea4-2b30-4b38-a641-ccf0a35c99c1,Gérard-Frédéric Joly,2024-06-25,Hasard du couper classe roman rire contre ne parfaitement.,0.5,300,
ad0d7bff-1dab-4484-a61f-7ba6ec6bfe73,63d65e67-1fa9-458c-80ac-b86c279683ed,4d1333a4-d0c7-4c36-9580-2a400135c126,Victor du Vasseur,2025-05-17,Courant robe suivant expérience froid.,0.5,250,0942ecc5-4e4a-4be5-9049-06683096acf8
89e01f13-1b61-459a-b00a-a3eb06ee9b40,63d65e67-1fa9-458c-80ac-b86c279683ed,d0be7ecc-0745-4454-a3cc-2d2868b6b3d8,Aurore Maury-Briand,2025-02-11,Étaler pointe valeur proposer maladie.,0.25,220,
051b76c5-4054-4254-8c32-16353c86d79e,f7f7d702-9eb1-4c55-aa8d-219d697febb5,4d1333a4-d0c7-4c36-9580-2a400135c126,Victor du Vasseur,2023-01-04,Montrer inutile étroit ouvrage mince chambre.,0.5,180,
f1fe654e-d1df-4768-85cd-4477a28d899c,8492a77e-d4fd-44f2-9a64-6257ba4e3007,99f39dfa-f1e2-4ec1-be06-d65859789f1f,Alexandre Traore,2022-09-24,Grand fer autorité avec répandre égal caractère défendre obliger.,1.5,220,93457ee0-426d-4933-ab8c-c892c451f236
86e3237c-03fd-43b1-b87a-1907475ff491,0a5f032e-0484-49a5-81be-b3859161ef05,4d1333a4-d0c7-4c36-9580-2a400135c126,Victor du Vasseur,2025-05-25,De traverser toile dessus.,1.0,220,
210e2bc2-e2eb-4ed4-b8b3-83dd7bd956f0,ceeba2d5-ebc1-4e46-b739-10829fa683d2,57bf8456-f58d-41c6-afc3-2e24e3b187b4,Gabriel de Guilbert,2024-09-27,Aussi sommeil vert avance moyen si tout lèvre.,1.0,220,
7542ba81-ee2e-4065-9ad0-f98d95eb16d0,b2bd2fa7-4177-4eef-801d-e4636cbfd6cb,495caabb-57b9-4f6c-a1a0-256d5fc15acf,Denis-Franck Ledoux,2025-01-14,Asseoir pouvoir ça intérieur terreur direction ami est digne espérer réel.,0.25,250,da36b6b6-a0b2-4164-8994-13e48c6bec2c
8d84196a-5d22-416a-9264-bf09f556663a,5eb7e4b2-59f0-4004-94ce-6723c90bd53e,4d1333a4-d0c7-4c36-9580-2a400135c126,Victor du Vasseur,2024-08-29,Mémoire puisque tomber phrase souffler demain.,0.5,250,dbda0e17-76f5-4749-9804-da40be7d17c3
e4ecd0a5-089d-4682-900c-3f447bff4e71,5232e692-68f1-437c-bb6e-f8e1b4fb09a1,495caabb-57b9-4f6c-a1a0-256d5fc15acf,Denis-Franck Ledoux,2022-09-25,Tandis Que premier réfléchir animal visible tu nuage or avis mesure.,0.5,220,9c309db9-aeed-43e0-a88e-005878dd61a5
8ca93d4c-8bd8-41bb-b71b-2c039c730269,2e469faf-03f8-44f4-b0c9-b787d01e2e0e,495caabb-57b9-4f6c-a1a0-256d5fc15acf,Denis-Franck Ledoux,2024-07-22,Profond bout lequel debout être jaune renverser.,1.5,300,9bf52795-a9f2-4357-b3cf-c515a594a681
0a72aad5-611d-45b1-bbff-009c811d52e0,fa87aa0d-a900-46bf-8e1b-056cd4c896ce,d0be7ecc-0745-4454-a3cc-2d2868b6b3d8,Aurore Maury-Briand,2025-07-15,Aider as remarquer rocher marche simple point.,1.0,300,
45cd960c-95cb-491c-81da-0075907b8533,7025280f-b901-4743-942f-5188308aa0f6,495caabb-57b9-4f6c-a1a0-256d5fc15acf,Denis-Franck Ledoux,2025-06-28,Métier arrivée réfléchir pourtant.,0.25,300,
1e108c65-477d-436b-9870-08916443a365,ec184383-99d6-4bf4-9ad4-fd7dd113b9d2,fba0cbe6-1a09-4487-946b-d85567269b04,Laurence Robert,2024-01-15,Mentir camarade caractère où taille étroit été terrible demi.,2.0,180,
e0c88ed4-bf78-461d-9803-f6513aa58e3d,383e47f4-9dc5-4c97-8959-a35de338f901,fba0cbe6-1a09-4487-946b-d85567269b04,Laurence Robert,2022-07-04,Accuser gagner rang rien mari après réveiller son désormais assez.,0.25,300,
80d1841f-44a6-4eab-9c5d-214a5b6953c2,84735a55-224d-4cbf-b7e6-047615e4ccae,0ee105d0-7745-4c96-bbf0-3df65bd210ab,Marcel Leblanc,2022-01-20,Haut droit enfermer observer succès vue.,0.25,300,
c11a2092-7c5e-4e08-b4d7-515b4f05ffe0,9bec7d9b-ca21-4ce2-8f26-deaaccd0d787,57bf8456-f58d-41c6-afc3-2e24e3b187b4,Gabriel de Guilbert,2024-02-09,Former personne personnage avant transformer course près roman sur silence.,1.0,220,
e5d4bd16-7daa-437a-860e-92f152a7320e,7045eea4-e3d4-4c2a-85cd-15203afcc15d,99f39dfa-f1e2-4ec1-be06-d65859789f1f,Alexandre Traore,2024-11-27,Trembler renoncer éclat perdre mal distance pouvoir.,1.5,250,e8d442a7-4721-4492-a2b9-443d4f56f314
4af56a75-4fd4-4d1a-9ab8-1447e9a61e8d,87db4dd7-2b2a-4fa6-9861-45c572cbf7fa,495caabb-57b9-4f6c-a1a0-256d5fc15acf,Denis-Franck Ledoux,2023-12-25,Art système près palais doux.,0.25,300,
330fbd15-b3a5-428a-b92b-bcef600a1f69,93ad3a40-c852-43b8-af5e-7f8d608aba02,4d1333a4-d0c7-4c36-9580-2a400135c126,Victor du Vasseur,2025-03-11,Selon madame émotion mettre ce projet.,0.5,250,
0f0d5089-acb2-440c-b9d1-90a42e4285d3,545b783a-2080-4167-ad84-2651e2342fb5,a9f97ea4-2b30-4b38-a641-ccf0a35c99c1,Gérard-Frédéric Joly,2025-05-16,Animer demain haute réduire un aider.,1.5,250,
3e7a90bd-b5b4-4343-8126-05528acce90a,9f1536ed-7682-4baf-b712-a636e5d0bef7,4d1333a4-d0c7-4c36-9580-2a400135c126,Victor du Vasseur,2024-05-02,Douleur fils sang barbe douter ombre lendemain.,1.0,220,
a0362f4c-0959-4106-aaa0-0be8ec56bd02,c2b04ca8-21a2-4b09-846e-846f4ea91d9a,495caabb-57b9-4f6c-a1a0-256d5fc15acf,Denis-Franck Ledoux,2024-06-18,Hier de feuille petit marchand petit amuser recueillir.,1.0,180,
de0ad405-fb19-41b8-aa4c-8e8792af45ab,d2b7d700-e402-4d2b-a73e-77c67e524ee8,99f39dfa-f1e2-4ec1-be06-d65859789f1f,Alexandre Traore,2024-11-12,Rappeler esprit sans dire rapide curieux allumer promettre paix soir.,0.25,300,
ed5d7959-945b-4695-bdfb-57c4ea10dce3,ec184383-99d6-4bf4-9ad4-fd7dd113b9d2,57bf8456-f58d-41c6-afc3-2e24e3b187b4,Gabriel de Guilbert,2025-07-16,Rien mettre un toute durant.,1.0,220,
7ba521ff-e14f-4efb-a26a-3462252b46bf,843a9872-f627-46be-93a6-67a7a4742534,0ee105d0-7745-4c96-bbf0-3df65bd210ab,Marcel Leblanc,2024-06-03,Goutte prix règle difficile veille instinct volonté demi te.,0.5,220,
e6869e4f-d2af-4969-a42b-81985d1b828b,7b45d1aa-eabb-411d-a194-e0ecfbe6e782,0ee105d0-7745-4c96-bbf0-3df65bd210ab,Marcel Leblanc,2025-04-14,Bas désormais meilleur essuyer fonder ou expression.,0.25,300,
8569fc19-4c85-4bf7-b16b-8132c5f86731,8a31273e-23eb-4904-b9df-c1fea644ed08,d0be7ecc-0745-4454-a3cc-2d2868b6b3d8,Aurore Maury-Briand,2024-10-27,Répandre robe offrir ceci montagne entendre discours.,0.5,250,
91d9a1d0-5c54-40bd-b045-a383ede06dac,dd66d9ff-2cb9-4001-b6ba-d50c6db32d2e,0ee105d0-7745-4c96-bbf0-3df65bd210ab,Marcel Leblanc,2022-10-08,Inconnu haute installer vers jeune sens d'abord assurer travail.,1.5,250,161ede77-5ca9-4be8-8229-f7497508a136
