temps_id,id_dossier,id_avocat,nom_avocat,date_prestation,description,heures,taux_horaire,facture_id
50b855af-49c0-4b7a-b5a6-32fe33c31ae2,f8274b5f-57fb-4135-8047-e10f465da7a3,d0be7ecc-0745-4454-a3cc-2d2868b6b3d8,Aurore Maury-Briand,2025-01-16,Chaise delà venir pendre intention terrain.,0.5,300,
d29dd6e5-9fce-454f-b00e-45418e4f268d,5fbb65d1-2cae-4bad-89a3-1e0cf2a645e3,99f39dfa-f1e2-4ec1-be06-d65859789f1f,Alexandre Traore,2025-03-28,Droite ferme hauteur durant dès.,0.25,180,c8f566c7-5e16-451b-acfe-0f980f740b3c
f7c29da6-6bb0-4e21-923d-01bfa8d43860,573285a1-761a-4c72-9cbf-fbd79cc6da88,57bf8456-f58d-41c6-afc3-2e24e3b187b4,Gabriel de Guilbert,2024-02-08,Ou trois étude plutôt précieux bout.,0.25,250,
dd003dec-e008-46c5-ab94-52a4b9346f64,9ac0a98a-83c1-44c7-a7c5-e133505b66ed,d0be7ecc-0745-4454-a3cc-2d2868b6b3d8,Aurore Maury-Briand,2023-05-29,Vieux grand glace grand assurer comprendre intérieur supposer genou.,0.5,220,
3c31217d-27c9-43f5-ad12-0faf8ccc6186,aabd37b3-d214-4f66-bf6d-a323435a95e0,57bf8456-f58d-41c6-afc3-2e24e3b187b4,Gabriel de Guilbert,2023-01-31,Répéter clair bas précipiter entendre.,2.0,250,
5e29d329-38fb-48f0-a971-e56f8acdf28c,1a1f3ea6-0bf9-4d2a-befa-49d35c6d1d67,fba0cbe6-1a09-4487-946b-d85567269b04,Laurence Robert,2025-06-04,Frère autrement produire attaquer cerveau.,1.0,220,9f0c9757-5ab3-4958-941d-07c562b67465
e3995a0e-4045-4ffe-82dc-a76ad3d7173b,e6c15b83-4920-4ed7-b094-4fe8eeb78588,52fc2f51-6484-441d-a3ac-19515cc8485f,Yves Traore,2023-12-01,Foi parce que poète herbe fine.,0.5,220,
b3ce3351-60b2-4169-94c1-1d1a94a31690,6e6176c0-f267-4ad2-b06f-cf818f9ceea1,495caabb-57b9-4f6c-a1a0-256d5fc15acf,Denis-Franck Ledoux,2025-02-09,Part courir descendre cheveu police ce exécuter chose soleil.,1.5,220,
c9852e77-56fc-4a0f-aae5-386c8aab6b03,435ed83c-bb7e-465c-b4aa-287d9d1e6957,2cb6b053-969a-40a2-a054-223a2f3f11e1,Alexandre Morin,2025-04-13,Prochain paysan fait dans leur banc sentiment oeuvre contre appartement.,0.5,180,
5cad2c89-2227-48a5-8a5d-680951ec7f2c,e20911e6-4c21-4262-952d-3657f232b68c,fba0cbe6-1a09-4487-946b-d85567269b04,Laurence Robert,2025-06-26,Sauter relever descendre ramener mois poussière son premier autre.,0.25,180,2a2366b4-036c-4799-9e9c-d642f6095267
fb4a0baa-753b-4054-980d-35296a14e2df,a0628de8-7218-44d1-818e-0d574f9fed8f,4d1333a4-d0c7-4c36-9580-2a400135c126,Victor du Vasseur,2025-02-06,Hasard nul parce que seuil fidèle crainte vide.,1.5,220,
5faaab99-f17c-4aac-ac93-5111de7f7ee8,c102b141-a882-4db1-8f7b-061fa3909fe6,fba0cbe6-1a09-4487-946b-d85567269b04,Laurence Robert,2025-07-21,Prévenir bord peser couper poitrine gagner montrer source étaler creuser.,2.0,220,
143e30a6-2c0a-49a6-9356-a31642cd1c88,35e0b91a-7738-44b0-9dc6-314af0111e05,fba0cbe6-1a09-4487-946b-d85567269b04,Laurence Robert,2024-07-16,Appel bleu dormir somme rompre rêver.,2.0,250,
63d1cfa6-ed52-4d34-8031-fe871ad237bf,84735a55-224d-4cbf-b7e6-047615e4ccae,57bf8456-f58d-41c6-afc3-2e24e3b187b4,Gabriel de Guilbert,2022-07-05,Fonction connaissance histoire ressembler dans souvenir au chasse confondre.,0.25,220,09dea943-0608-46fa-bf4f-739d32c8d959
21c2f4d7-aa45-46c9-9c38-bc4ae63ea5b0,383e47f4-9dc5-4c97-8959-a35de338f901,52fc2f51-6484-441d-a3ac-19515cc8485f,Yves Traore,2023-04-22,Très dans rire désir tuer faible folie tout.,0.25,220,
3f32fec4-97f6-4519-9d54-e41217ca61aa,2466c1bb-7f5c-4236-961f-ecec05719d7a,2cb6b053-969a-40a2-a054-223a2f3f11e1,Alexandre Morin,2025-04-01,Intéresser fumée malgré longtemps noire circonstance doute réveiller durer fait cas.,0.25,250,
c70698fe-2367-4b62-a1aa-cf7d42b0b89d,a85698f6-489d-444f-b170-5483f65a5958,99f39dfa-f1e2-4ec1-be06-d65859789f1f,Alexandre Traore,2024-04-30,Paraître enfin valoir naissance vide genre fille tour.,2.0,300,
8b2cc436-7ffd-47d1-ae56-895d307d60a2,d2b7d700-e402-4d2b-a73e-77c67e524ee8,2cb6b053-969a-40a2-a054-223a2f3f11e1,Alexandre Morin,2024-12-14,Rouler article glisser celui honneur général.,0.5,250,
6b4201c4-86e5-41dd-9f72-c2fdef48f9e7,38e3550b-3272-4de0-ab86-e4d02923f1ad,fba0cbe6-1a09-4487-946b-d85567269b04,Laurence Robert,2024-03-09,Nu dégager ensemble aider hauteur remplir.,1.0,220,abb78fb1-50cf-4bcb-be0f-03751bac69f9
7f8b98d9-f444-4d06-a924-4e12df96700d,92254682-bed5-4684-9a86-f26e05d1683e,2cb6b053-969a-40a2-a054-223a2f3f11e1,Alexandre Morin,2023-08-16,Soirée autre moyen élever soleil personne table.,1.5,300,
aa1eafee-1806-4ca0-b535-e04105fd7de7,3cf05f82-1e8a-4f73-a5ce-baf9dd9191b0,fba0cbe6-1a09-4487-946b-d85567269b04,Laurence Robert,2024-03-09,Représenter éclat le mer signe train.,0.25,250,
fe37b4f3-b06c-4935-8ae2-a586463a2377,9bec7d9b-ca21-4ce2-8f26-deaaccd0d787,495caabb-57b9-4f6c-a1a0-256d5fc15acf,Denis-Franck Ledoux,2025-04-27,Dur étendue larme monde.,0.25,180,
e8f6f2d0-7a88-4b7e-8dd4-287d286ba170,f7f7d702-9eb1-4c55-aa8d-219d697febb5,fba0cbe6-1a09-4487-946b-d85567269b04,Laurence Robert,2022-10-13,Campagne lutter pouvoir arrière ainsi défaut oncle cesser.,1.5,300,ae0e802c-8b23-496e-ad5e-e6dc6804f5ec
9f59bb86-0282-45f8-80f5-18928a8b36b6,3cf05f82-1e8a-4f73-a5ce-baf9dd9191b0,4d1333a4-d0c7-4c36-9580-2a400135c126,Victor du Vasseur,2024-05-31,Milieu sein trésor trou remarquer convenir payer souhaiter pourquoi.,1.0,250,
4edf1159-2ec1-439e-9a3d-852370cd419d,c8986a69-d97e-4f85-a9a3-f1d85d927eb2,4d1333a4-d0c7-4c36-9580-2a400135c126,Victor du Vasseur,2025-02-08,Engager printemps force fou prouver acte cou.,1.0,220,
90ce7505-8f80-4507-9f3d-0685ce655a4c,15ca8e8c-203a-4697-a48b-7fc01e16b255,0ee105d0-7745-4c96-bbf0-3df65bd210ab,Marcel Leblanc,2025-05-26,Plan sérieux répéter rire grain absolument auquel.,0.5,300,
04405893-86c6-40ff-a21d-99d1298e8550,84735a55-224d-4cbf-b7e6-047615e4ccae,fba0cbe6-1a09-4487-946b-d85567269b04,Laurence Robert,2022-05-26,Allumer trouver armée souvent plus éclat.,0.25,250,
054a2617-6695-4148-8528-2a441b8cf610,852e0a6d-857f-468b-bcec-6f38a233264a,99f39dfa-f1e2-4ec1-be06-d65859789f1f,Alexandre Traore,2024-07-07,Fixe détruire vérité mêler cours rang.,0.5,180,d8d27215-f42e-4207-afce-91e6567f74d7
8f21789c-15bd-42a9-82e0-61a09c41dd75,6c4e095b-962a-4e27-907b-fa5a90a4dba3,a9f97ea4-2b30-4b38-a641-ccf0a35c99c1,Gérard-Frédéric Joly,2024-01-03,Pluie figure trop loin travail possible odeur leur quartier.,0.5,220,
f2f8ae38-a454-4a23-9f63-b26153146993,89d0bf59-65aa-455e-93a9-d2c27c05e91d,99f39dfa-f1e2-4ec1-be06-d65859789f1f,Alexandre Traore,2024-04-11,Figure seul passé détruire terreur sueur.,0.25,250,
466a06cf-5797-4eb1-97b6-b084fb83e64d,3ebb9085-e5b4-45fe-9371-6ea9ec7f365c,52fc2f51-6484-441d-a3ac-19515cc8485f,Yves Traore,2025-06-28,Cesse moi fatigue gens monsieur science calme construire dimanche famille.,2.0,300,
98224e88-958b-419a-806b-16b69af7c834,de856a6f-54a3-4733-9048-d8edc3c8939a,a9f97ea4-2b30-4b38-a641-ccf0a35c99c1,Gérard-Frédéric Joly,2025-05-23,Tout femme saison vêtement songer avec surtout éclairer bureau étendue.,2.0,180,d3ade144-4a0f-4618-a98f-eb675a4acdaf
4ed5bd16-9819-45d2-8309-baaaf7aa1e0d,f7f7d702-9eb1-4c55-aa8d-219d697febb5,a9f97ea4-2b30-4b38-a641-ccf0a35c99c1,Gérard-Frédéric Joly,2024-06-16,Mauvais armée un puisque mur.,0.5,180,
59dd4c0b-8098-4e98-b7ed-a8b515fae30a,7045eea4-e3d4-4c2a-85cd-15203afcc15d,99f39dfa-f1e2-4ec1-be06-d65859789f1f,Alexandre Traore,2023-03-04,Devant aussi dresser dominer au frapper suivre.,1.5,220,efb187c0-e0a8-4444-8f86-105b8f1bf82f
693dd621-d621-47df-8b80-ebeadba98413,a2f8336d-9fa5-4feb-a147-9bea04d1b010,57bf8456-f58d-41c6-afc3-2e24e3b187b4,Gabriel de Guilbert,2025-02-25,Porte scène continuer particulier bord.,2.0,220,
98fe1ab4-4489-453f-999d-b451f5cadb88,504deb90-f00c-48a8-8bfe-67703473c009,fba0cbe6-1a09-4487-946b-d85567269b04,Laurence Robert,2024-11-08,Jardin immobile étude arracher appeler passage.,2.0,220,
e09cc968-329d-4be2-b480-872200344187,f7bf44a5-d389-47da-97b5-2092817aed72,fba0cbe6-1a09-4487-946b-d85567269b04,Laurence Robert,2022-03-07,Lumière ennemi dresser bureau sein humain dire beauté.,0.5,180,4fc0159b-178f-4eab-935a-9ec6252d2e66
9bdd8c97-309b-451c-a3bb-192d3e5c9fb5,7887fae6-96f7-4f43-9ff8-4544fd4c2336,52fc2f51-6484-441d-a3ac-19515cc8485f,Yves Traore,2024-12-25,Choix inconnu tendre bord sur.,2.0,220,
36e58fb8-fa2a-4b3e-8632-8f0400ce1a22,89d0bf59-65aa-455e-93a9-d2c27c05e91d,d0be7ecc-0745-4454-a3cc-2d2868b6b3d8,Aurore Maury-Briand,2025-03-20,Pays courir préférer haine briller lumière fleur visible l'une gloire.,0.5,250,
8e7eecc1-0045-4f3e-bc90-6a84b2fa1a77,00fa7c13-1986-4c7e-923a-0fa0825ff147,52fc2f51-6484-441d-a3ac-19515cc8485f,Yves Traore,2025-06-19,Mort salut fin exécuter pur magnifique pièce circonstance aujourd'hui solitude.,1.5,250,
60e8ba60-90c9-40f0-86cf-e2ed581f4862,ed2e758f-1b23-45bf-8701-decd93182ddb,2cb6b053-969a-40a2-a054-223a2f3f11e1,Alexandre Morin,2025-02-13,Soin escalier violence couvrir content exemple matière noir.,0.5,300,e3446b18-0831-46e7-98be-e58a0b286516
9aea48b7-e057-4e72-9eca-590dfdb9a998,7b45d1aa-eabb-411d-a194-e0ecfbe6e782,0ee105d0-7745-4c96-bbf0-3df65bd210ab,Marcel Leblanc,2025-05-11,Haut chercher famille façon départ désespoir personnage rejeter.,0.25,250,7db594ee-e21e-4aee-a6f6-98a8a60d9922
4dca7af2-2f7e-4b70-9227-09fdb4b65f44,aabd37b3-d214-4f66-bf6d-a323435a95e0,99f39dfa-f1e2-4ec1-be06-d65859789f1f,Alexandre Traore,2024-09-18,Dresser fixer petit bien tant précipiter.,0.25,300,
28e4d6bc-6f50-42c5-9409-7ab80d0eab9f,f7bf44a5-d389-47da-97b5-2092817aed72,495caabb-57b9-4f6c-a1a0-256d5fc15acf,Denis-Franck Ledoux,2023-03-02,Apprendre point matière distance grâce mener odeur craindre rond remplacer.,1.5,180,
0d6cfeeb-3fab-4ec4-9b19-cca4c9fdc68a,1a1f3ea6-0bf9-4d2a-befa-49d35c6d1d67,99f39dfa-f1e2-4ec1-be06-d65859789f1f,Alexandre Traore,2025-02-19,Résistance étaler ciel saluer conclure rapidement.,0.25,250,
4becaf4a-308b-4962-b240-84e0ee5decd3,c102b141-a882-4db1-8f7b-061fa3909fe6,495caabb-57b9-4f6c-a1a0-256d5fc15acf,Denis-Franck Ledoux,2024-03-03,Ministre paysan devant autant fatiguer quarante attendre ensemble songer fatigue.,0.25,250,
76954e25-dbab-4f1b-a1d5-3ca71ef0fa20,9eb7c745-68f4-40bc-b8ad-2e733e75d5c6,fba0cbe6-1a09-4487-946b-d85567269b04,Laurence Robert,2022-11-23,Briller demi rêver instant contenter terminer mari mois intérieur.,1.0,300,
4a0fe489-7bcc-4454-8830-d99674e1fef8,11400748-cd6e-4a60-a8dc-b8ccfaf13cb7,fba0cbe6-1a09-4487-946b-d85567269b04,Laurence Robert,2024-04-24,Réfléchir de soin sens tuer ressembler intention théâtre tuer.,1.0,220,58ed5d4e-4579-4e37-b9e3-333969267aac
0bb9bf8a-f78f-43e2-b862-380f08066094,ec184383-99d6-4bf4-9ad4-fd7dd113b9d2,57bf8456-f58d-41c6-afc3-2e24e3b187b4,Gabriel de Guilbert,2022-09-15,Souffler liberté changement cependant puis pensée.,1.5,300,
3d98c0ce-6c26-4bf1-b870-0ecc52184d53,63d65e67-1fa9-458c-80ac-b86c279683ed,4d1333a4-d0c7-4c36-9580-2a400135c126,Victor du Vasseur,2024-10-12,Abandonner observer accorder tard chaud arme.,1.5,300,
e5a96499-a6ea-4865-a261-8ba99640dd30,33c2409d-4c78-4c01-829d-ec90310d94b2,4d1333a4-d0c7-4c36-9580-2a400135c126,Victor du Vasseur,2025-04-29,Changer écraser écarter curieux plutôt arrière quart.,1.5,180,
8ef34738-b2c7-4212-8432-fd74d1957d81,9eb7c745-68f4-40bc-b8ad-2e733e75d5c6,4d1333a4-d0c7-4c36-9580-2a400135c126,Victor du Vasseur,2023-09-04,Voici bien ouvrir toujours prétendre grand cas nation parmi.,0.5,300,
1577fb0e-810f-42ed-88e7-9a54c6fdf1a2,478ddbef-c815-4bf6-b821-65f2bb0b6c0a,52fc2f51-6484-441d-a3ac-19515cc8485f,Yves Traore,2023-07-20,Façon ombre étranger fort regretter frère appartenir oiseau.,0.5,220,14f95daf-f58a-4aa5-bd06-1524fae22415
75211286-c700-4b42-8c6a-06670579b82d,383e47f4-9dc5-4c97-8959-a35de338f901,fba0cbe6-1a09-4487-946b-d85567269b04,Laurence Robert,2025-01-05,Mais delà durant discuter âge preuve chez trait.,0.5,250,
749032f6-a142-4706-b4df-8329e7984730,35e0b91a-7738-44b0-9dc6-314af0111e05,fba0cbe6-1a09-4487-946b-d85567269b04,Laurence Robert,2023-07-06,Voilà fidèle prêter côte importance couleur.,1.5,220,
6cf21148-74cc-4953-b9c0-a8af778fce9b,8cf0b6c8-f1da-4f40-a76c-dc08ce92da3b,2cb6b053-969a-40a2-a054-223a2f3f11e1,Alexandre Morin,2025-06-29,Secours nation recherche dernier papier admettre.,0.5,220,
99d968f6-2e31-4ba8-8561-4dc69d99856b,f28715a5-6113-4310-944a-97fc62d6dcf8,4d1333a4-d0c7-4c36-9580-2a400135c126,Victor du Vasseur,2022-09-20,Pourquoi je dernier arracher calme larme passé calmer.,1.5,220,
0e82ade8-85f8-4c92-a0cf-ef1da3718555,f7bf44a5-d389-47da-97b5-2092817aed72,57bf8456-f58d-41c6-afc3-2e24e3b187b4,Gabriel de Guilbert,2023-02-20,Question billet autant président tellement.,0.25,180,
6dc65e8c-82d6-45b4-9721-f3a7648d76cd,a76e2480-dc6b-4d7a-89cf-cbc9848c15d2,495caabb-57b9-4f6c-a1a0-256d5fc15acf,Denis-Franck Ledoux,2023-10-26,Amour ancien foule minute.,1.0,220,81f126b2-c889-475d-a58c-03f8fba295c2
eb41aa7f-137a-4938-b624-ba2fb1e6a904,2e469faf-03f8-44f4-b0c9-b787d01e2e0e,4d1333a4-d0c7-4c36-9580-2a400135c126,Victor du Vasseur,2024-09-22,Sens témoin nuage société terrible courant énorme.,1.5,180,
6deb9ffc-2742-4304-b545-958014605340,5232e692-68f1-437c-bb6e-f8e1b4fb09a1,57bf8456-f58d-41c6-afc3-2e24e3b187b4,Gabriel de Guilbert,2024-07-31,Prévenir existence sujet obéir bruit morceau interroger beauté détacher.,1.0,300,
be39a18d-8ad2-4475-aac4-fd594e6d277d,9bec7d9b-ca21-4ce2-8f26-deaaccd0d787,0ee105d0-7745-4c96-bbf0-3df65bd210ab,Marcel Leblanc,2024-05-07,Tomber vivre fixe droit savoir roi ailleurs couvrir trente.,1.0,250,
cf67c6ce-070d-40f4-a711-10782375cfdd,c43cfe86-737c-4c21-9a89-b9ea98543080,57bf8456-f58d-41c6-afc3-2e24e3b187b4,Gabriel de Guilbert,2023-12-29,Rouge froid façon rencontrer chanter fonction.,2.0,300,
d94ec2e6-4a17-4971-aa13-8e4fc1e2db2d,1a1f3ea6-0bf9-4d2a-befa-49d35c6d1d67,57bf8456-f58d-41c6-afc3-2e24e3b187b4,Gabriel de Guilbert,2025-04-23,Signifier non combat prochain plaisir écarter apparence.,1.5,220,e0771ff8-6361-4eca-891c-2041a03c884d
4ef6d1d6-ceff-458f-8df6-ba8ba66e2238,e8bf4353-788a-4115-852c-00140a9d4527,57bf8456-f58d-41c6-afc3-2e24e3b187b4,Gabriel de Guilbert,2025-02-20,Aide foi armer emmener qui résister.,1.5,250,
4e71ee54-c6a4-4882-abb3-9f53250461e7,1b08e87f-ec7c-48b6-88e9-bfa9c62e2a81,57bf8456-f58d-41c6-afc3-2e24e3b187b4,Gabriel de Guilbert,2023-01-04,Nom mine est craindre charge.,0.5,220,
412dae2a-7cd4-48fe-9368-c8d040301102,87db4dd7-2b2a-4fa6-9861-45c572cbf7fa,d0be7ecc-0745-4454-a3cc-2d2868b6b3d8,Aurore Maury-Briand,2022-04-29,Usage courage assez pauvre promener voir ensuite glace.,2.0,220,
c2f889bc-99f3-4053-8aa7-25b253efba03,fa87aa0d-a900-46bf-8e1b-056cd4c896ce,fba0cbe6-1a09-4487-946b-d85567269b04,Laurence Robert,2024-08-06,Figure preuve savoir coup action tard.,2.0,300,
31deea2b-4803-4609-846e-036fec93d184,f24d314f-7164-4d41-ab19-5da9a7545fd8,0ee105d0-7745-4c96-bbf0-3df65bd210ab,Marcel Leblanc,2025-05-24,Nom mal nous demain mettre.,0.25,300,
204b2bd5-5768-488d-8a19-022f3cafa71d,2466c1bb-7f5c-4236-961f-ecec05719d7a,a9f97ea4-2b30-4b38-a641-ccf0a35c99c1,Gérard-Frédéric Joly,2025-04-28,Propos risquer en saisir verser.,2.0,300,
e1644811-75c4-40ed-9500-4d908915842f,dd66d9ff-2cb9-4001-b6ba-d50c6db32d2e,a9f97ea4-2b30-4b38-a641-ccf0a35c99c1,Gérard-Frédéric Joly,2022-09-30,Pauvre troubler esprit un aucun mêler trésor rapporter par arracher.,1.5,300,
92bcf20d-8b99-44b4-a903-29e3227e2b3d,11cb12b7-6500-4cf7-8cdf-0d93efb55921,52fc2f51-6484-441d-a3ac-19515cc8485f,Yves Traore,2023-09-02,Tombe présence partager général beau.,1.0,180,
f3104d80-2b38-43f8-8f51-5ca718b43ffd,99f0fbb9-d8d9-4ef2-b8be-ddab91aa33d8,99f39dfa-f1e2-4ec1-be06-d65859789f1f,Alexandre Traore,2025-06-04,Fond marche patron lors roche changer chaleur partie machine.,1.0,250,
077bb8fb-28bb-4214-aaa2-956bf6d8eded,edb86c4c-8504-4e7f-a82b-3185341de3b9,0ee105d0-7745-4c96-bbf0-3df65bd210ab,Marcel Leblanc,2025-03-12,Embrasser importance pouvoir devenir immobile absolu étouffer printemps autrefois sans.,0.5,250,
2515cf74-6db5-459d-bbc4-4a547252bd61,8492a77e-d4fd-44f2-9a64-6257ba4e3007,57bf8456-f58d-41c6-afc3-2e24e3b187b4,Gabriel de Guilbert,2022-10-27,Violence point trop pleurer que.,2.0,220,
f3ae5ef2-76dc-48ba-910a-200f26c04d13,8c64a9b1-2a6b-4d38-b2c4-27410cdcc6a5,495caabb-57b9-4f6c-a1a0-256d5fc15acf,Denis-Franck Ledoux,2023-03-01,Guerre tout odeur ouvrage écarter chance million voile quinze changement gloire.,2.0,180,46eca31c-e9cc-497a-a391-36cd55564b16
67665ca0-cade-4ac9-b0d6-73df6e6db479,ceeba2d5-ebc1-4e46-b739-10829fa683d2,0ee105d0-7745-4c96-bbf0-3df65bd210ab,Marcel Leblanc,2022-09-27,Y puisque exécuter amener propre françois jour jeter soit.,2.0,250,1dec1dbb-a377-4087-931d-2c09137bd3cd
25573fc1-2b09-4907-ac01-be2b1a559977,c8986a69-d97e-4f85-a9a3-f1d85d927eb2,99f39dfa-f1e2-4ec1-be06-d65859789f1f,Alexandre Traore,2024-11-09,Je solitude cela manger robe curieux toucher guerre maître.,1.0,250,da5a64bf-a428-424e-8b85-4aa469280872
d85a33f8-05e0-498e-a484-af753be02c5c,38e3550b-3272-4de0-ab86-e4d02923f1ad,99f39dfa-f1e2-4ec1-be06-d65859789f1f,Alexandre Traore,2024-12-02,Ainsi propre forêt remonter passé importer frais non.,1.5,180,
86e827b8-c086-4a02-b206-9086d1594eee,e20911e6-4c21-4262-952d-3657f232b68c,fba0cbe6-1a09-4487-946b-d85567269b04,Laurence Robert,2025-06-20,Guère heureux sauvage lueur montrer porter honte forme tu.,1.5,220,
b99fe77b-458a-4b89-95c0-242dc71f452f,f24d314f-7164-4d41-ab19-5da9a7545fd8,a9f97ea4-2b30-4b38-a641-ccf0a35c99c1,Gérard-Frédéric Joly,2025-06-19,Considérer terre observer suite marquer oiseau.,1.0,300,afad3abe-b76c-42c5-8179-3ccd0ff072fb
95cb3bd3-da32-43f5-8452-b7d0a631459c,3ba4c7d7-5a41-486e-8bef-3fe7e7c59a05,2cb6b053-969a-40a2-a054-223a2f3f11e1,Alexandre Morin,2025-07-07,Naturel depuis ennemi mari chair état jambe.,0.5,220,
87eb4447-6db5-4cb7-ae71-45afde3c1457,32da7216-fddc-4c53-bb9f-79e5d7c19e0d,a9f97ea4-2b30-4b38-a641-ccf0a35c99c1,Gérard-Frédéric Joly,2025-02-16,Habitant vieux second fidèle air secret.,0.25,250,
53219529-7c57-4b5c-98c6-f1631f8918e8,df65f114-c111-4815-a52e-37c3cf451607,52fc2f51-6484-441d-a3ac-19515cc8485f,Yves Traore,2025-03-06,Vaste marchand enlever tomber terrible trembler échapper religion.,1.0,300,
bde2cd46-c0a7-43b1-a907-84c860623907,478ddbef-c815-4bf6-b821-65f2bb0b6c0a,57bf8456-f58d-41c6-afc3-2e24e3b187b4,Gabriel de Guilbert,2023-07-21,Épais mesure consulter auteur saint nombre trouver étude.,1.5,220,
cbd999fc-2a08-4103-9616-e9adbf92c6e2,b2bd2fa7-4177-4eef-801d-e4636cbfd6cb,2cb6b053-969a-40a2-a054-223a2f3f11e1,Alexandre Morin,2025-01-12,Rêve marcher herbe peau selon en grandir aspect.,1.0,180,
6d3e6752-751f-48ef-b997-067245901937,50c42b4c-6d85-4a6e-9d89-69c434cdb044,52fc2f51-6484-441d-a3ac-19515cc8485f,Yves Traore,2025-03-06,Absolument occasion dimanche notre pas.,1.5,180,
8df4d74b-efcb-407c-80bd-20a44a064164,93ad3a40-c852-43b8-af5e-7f8d608aba02,52fc2f51-6484-441d-a3ac-19515cc8485f,Yves Traore,2025-07-13,Miser spectacle étranger inconnu armer dehors âgé chant côte.,0.25,220,
944901ee-72b7-4c32-a654-b250e4cf2477,2894aa01-a22f-4204-afd5-5ab69df9ca1a,a9f97ea4-2b30-4b38-a641-ccf0a35c99c1,Gérard-Frédéric Joly,2024-12-07,Public chercher parti au livre.,1.0,250,
a4b1f547-b9fe-4060-b685-110f5918399d,c4a1c050-32ab-4517-a48a-940bc6dc7edf,57bf8456-f58d-41c6-afc3-2e24e3b187b4,Gabriel de Guilbert,2023-05-11,Dos mort vêtement foule paupière étendre voyage classe seuil.,0.25,300,
c7d2db4f-459c-418f-a0bd-c9570406e9f7,f7bf44a5-d389-47da-97b5-2092817aed72,0ee105d0-7745-4c96-bbf0-3df65bd210ab,Marcel Leblanc,2023-06-23,Cri carte minute fin soutenir admettre un passage agiter chair.,1.5,300,
8a70575d-aec5-431e-9c40-b261ea09a527,8cf0b6c8-f1da-4f40-a76c-dc08ce92da3b,a9f97ea4-2b30-4b38-a641-ccf0a35c99c1,Gérard-Frédéric Joly,2025-07-03,Tandis Que pénétrer goutte différent revoir humain.,0.5,300,fdc6352f-ec3b-461b-b30f-63c024b750c7
9f280c95-d1c9-4c4e-bdff-ae5f2c80bed3,00fa7c13-1986-4c7e-923a-0fa0825ff147,d0be7ecc-0745-4454-a3cc-2d2868b6b3d8,Aurore Maury-Briand,2025-06-26,Trois puissant durer air rire léger répandre beaux passion.,0.25,180,220239e5-f865-4f21-8424-7d3976e9c123
1b009f79-b18d-4778-a495-e4b83d8514cb,a76e2480-dc6b-4d7a-89cf-cbc9848c15d2,99f39dfa-f1e2-4ec1-be06-d65859789f1f,Alexandre Traore,2023-03-20,Foi phrase nu table poche te devant.,0.25,220,
835b81c2-5728-43ee-9241-b8dfe1b3e380,6a0c1ae8-a761-407b-868f-a78dc2f8f267,52fc2f51-6484-441d-a3ac-19515cc8485f,Yves Traore,2025-07-15,Meilleur larme craindre pays détruire fauteuil deux projet.,2.0,250,
ec0473e7-6cc3-4cc3-8154-9735afc52aa5,a7ff57e5-b6d5-45e4-94c5-9665832397ae,99f39dfa-f1e2-4ec1-be06-d65859789f1f,Alexandre Traore,2024-07-05,Permettre supposer vieux peur genre toucher lourd place.,2.0,250,
8c5f5f20-f443-41fe-a5b9-c1b0ef05b6de,1d2ae70c-42d2-4253-9f9c-dba0833b12ef,0ee105d0-7745-4c96-bbf0-3df65bd210ab,Marcel Leblanc,2025-06-22,Couche effacer que découvrir travailler étudier mémoire grave circonstance.,0.25,180,1ebb36c5-bd04-4121-ac7b-f972c3345248
ec5df41a-a832-4b91-a2eb-4e6455841cd6,d51bdc64-5a8e-4e7a-83d7-b4f450018661,d0be7ecc-0745-4454-a3cc-2d2868b6b3d8,Aurore Maury-Briand,2025-05-08,Cuisine vingt sauter l'une dépasser amener phrase imposer façon.,2.0,300,f5701f15-d052-49de-9302-7e4cf21230d0
02ac4c45-5050-460b-9c1e-48e4b9b750a9,8a31273e-23eb-4904-b9df-c1fea644ed08,57bf8456-f58d-41c6-afc3-2e24e3b187b4,Gabriel de Guilbert,2024-01-08,Tomber table échapper cinquante.,2.0,220,
4fea6d7e-2433-4d52-a484-f259e6b95f0f,7025280f-b901-4743-942f-5188308aa0f6,0ee105d0-7745-4c96-bbf0-3df65bd210ab,Marcel Leblanc,2025-05-25,Rejoindre ombre dame satisfaire détacher dernier vif gros.,0.25,250,7d901a73-1923-462b-bed2-e0f82ad55bba
b351064d-158d-402e-acf9-bfb3e634ae52,84a94905-8226-4fec-965c-f570e03e334e,4d1333a4-d0c7-4c36-9580-2a400135c126,Victor du Vasseur,2024-12-22,Soirée an aimer profondément empêcher réunir expression prochain.,0.5,220,
050e48fc-3761-445f-98a5-5a5216427a4a,a0f81947-137b-47bd-8cac-2d771a70a3e0,57bf8456-f58d-41c6-afc3-2e24e3b187b4,Gabriel de Guilbert,2024-01-17,Divers indiquer puis accord immobile doux terreur rayon rayon monde.,0.5,250,
a84aa06d-435b-441f-ad3c-3768a0e1efe6,383e47f4-9dc5-4c97-8959-a35de338f901,a9f97ea4-2b30-4b38-a641-ccf0a35c99c1,Gérard-Frédéric Joly,2025-01-29,Honneur terme juste chanter vie enfin partie toile placer.,1.0,300,318e054d-41bb-4d87-8f64-9ab7f98169db
cd74252b-7c0e-4718-962c-5e4b122a3181,2f9ffe63-1122-4a41-b385-0fc011fd3e91,52fc2f51-6484-441d-a3ac-19515cc8485f,Yves Traore,2025-06-08,Depuis ton attitude chambre.,0.25,180,
cd273327-3cb8-4ffa-be32-d20688378b76,6949b152-88ab-4e80-a025-1562745e70ee,d0be7ecc-0745-4454-a3cc-2d2868b6b3d8,Aurore Maury-Briand,2025-06-18,Bureau apparaître cerveau pouvoir accent voler ailleurs conscience.,0.5,250,
ad1502ad-994b-4ce3-8313-e22e77b5f296,80feccbf-8f35-4dec-8a53-2ce879f745e3,495caabb-57b9-4f6c-a1a0-256d5fc15acf,Denis-Franck Ledoux,2025-05-25,Endroit éteindre sourire chance inquiéter.,1.0,250,
dbf69141-0b2d-4d28-8a49-114cb8d1ef77,00fa7c13-1986-4c7e-923a-0fa0825ff147,495caabb-57b9-4f6c-a1a0-256d5fc15acf,Denis-Franck Ledoux,2025-06-27,Saison raison pain savoir époque avenir produire.,1.0,220,
b71444a2-7836-4377-953a-8acd4ff6c965,2a9a1ecf-1338-43b8-80c7-f3c79edbe83d,99f39dfa-f1e2-4ec1-be06-d65859789f1f,Alexandre Traore,2023-02-19,Chanter personne muet dormir soleil.,0.5,220,
df391b8c-898d-49ce-8b19-f24909f54008,2f9ffe63-1122-4a41-b385-0fc011fd3e91,fba0cbe6-1a09-4487-946b-d85567269b04,Laurence Robert,2024-10-30,Connaître imposer discours mesure seigneur fier confondre plaindre.,1.5,250,
e648d25c-d590-4d76-b5e3-50b7090826b0,383e47f4-9dc5-4c97-8959-a35de338f901,495caabb-57b9-4f6c-a1a0-256d5fc15acf,Denis-Franck Ledoux,2022-08-03,Maintenir lentement maladie midi plusieurs.,0.5,300,
4cdf2415-0520-41a8-9320-80ec6710859b,d9d812c0-f98a-4596-a7f1-19c1be01c80c,d0be7ecc-0745-4454-a3cc-2d2868b6b3d8,Aurore Maury-Briand,2025-02-25,Etc avis parole groupe appartenir occasion tel.,0.25,180,
06f86940-97a4-4df0-8938-b8b46e471a21,b5c03709-2a38-4f91-a166-e6648c8a42cd,495caabb-57b9-4f6c-a1a0-256d5fc15acf,Denis-Franck Ledoux,2023-03-02,Dehors bien jambe tâche émotion santé enfance politique portier précéder.,0.25,180,
a7445bc2-8ce3-45a7-872b-14f839badb6c,545b783a-2080-4167-ad84-2651e2342fb5,2cb6b053-969a-40a2-a054-223a2f3f11e1,Alexandre Morin,2025-07-07,Chair consentir sentier gauche couleur hésiter fin vraiment changer.,1.5,300,
2f3011df-8ed2-4bcc-8464-7bee614ddf46,5232e692-68f1-437c-bb6e-f8e1b4fb09a1,a9f97ea4-2b30-4b38-a641-ccf0a35c99c1,Gérard-Frédéric Joly,2022-10-16,Sauvage femme goût professeur solitude combat grâce source.,0.25,250,e48ab03b-cc54-4fbe-ab6b-336c2f764eca
10db253e-5a08-4c9a-83a0-875ac76538cb,c8986a69-d97e-4f85-a9a3-f1d85d927eb2,57bf8456-f58d-41c6-afc3-2e24e3b187b4,Gabriel de Guilbert,2023-06-07,Amener devoir caresser vif père folie adresser paix attacher.,0.25,250,
44cecde7-bf1b-470d-bb21-513b75ba52f0,35e0b91a-7738-44b0-9dc6-314af0111e05,2cb6b053-969a-40a2-a054-223a2f3f11e1,Alexandre Morin,2024-09-28,Bande savoir dépasser résoudre demain ouvrage esprit.,0.25,180,
72462dab-0236-46a8-9894-87f35c876377,7887fae6-96f7-4f43-9ff8-4544fd4c2336,fba0cbe6-1a09-4487-946b-d85567269b04,Laurence Robert,2023-11-06,Quelqu'Un traverser endormir ancien épaule ou nombre chaque sable.,0.5,180,
72875665-d807-4ad3-82bf-af9c62350a87,b5c03709-2a38-4f91-a166-e6648c8a42cd,fba0cbe6-1a09-4487-946b-d85567269b04,Laurence Robert,2024-08-08,Décider rêver trou un cruel renverser sans manier milieu.,0.5,180,8177509c-eb60-470f-ab42-dc166b6dc5e3
a83e9c92-a004-4e6f-b575-fca90bd4915c,3ba4c7d7-5a41-486e-8bef-3fe7e7c59a05,495caabb-57b9-4f6c-a1a0-256d5fc15acf,Denis-Franck Ledoux,2025-01-22,Lien servir beaucoup éclairer chez chasser offrir.,2.0,250,3374dbc8-1c15-4034-b784-dda20e7d50f0
76e49875-9d8b-4b06-b8a7-1955972839b4,aabd37b3-d214-4f66-bf6d-a323435a95e0,52fc2f51-6484-441d-a3ac-19515cc8485f,Yves Traore,2023-08-01,Effort après poète mettre reposer demeurer désert cerveau.,0.5,180,
3ea54dd4-d072-4a73-919d-dd66f0a0d0ec,3a2c9f07-e085-4ce2-9a4c-4f7c1781d67e,99f39dfa-f1e2-4ec1-be06-d65859789f1f,Alexandre Traore,2025-04-09,Herbe instant oeuvre au prison éclater ainsi drôle.,0.25,300,
