temps_id,id_dossier,id_avocat,nom_avocat,date_prestation,description,heures,taux_horaire,facture_id
6633bd2f-89fa-4d07-a526-948d5bd6269b,d51bdc64-5a8e-4e7a-83d7-b4f450018661,495caabb-57b9-4f6c-a1a0-256d5fc15acf,Denis-Franck Ledoux,2025-03-28,Pareil joli feu social trente entrer ouvrage long remettre plaisir.,1.5,180,
b72d97a8-f00f-4fde-8bc2-a5ea2058958b,9bec7d9b-ca21-4ce2-8f26-deaaccd0d787,495caabb-57b9-4f6c-a1a0-256d5fc15acf,Denis-Franck Ledoux,2024-10-18,Surveiller midi protéger folie mentir confiance haut casser.,0.25,180,
979f575a-543a-4f86-954a-f60347c919a7,8c64a9b1-2a6b-4d38-b2c4-27410cdcc6a5,d0be7ecc-0745-4454-a3cc-2d2868b6b3d8,Aurore Maury-Briand,2025-02-14,Attitude porter couche reprendre proposer ton.,1.5,180,b18e2d3d-4fc4-4450-81a6-014f7a5cb413
eeae5f8b-8092-4b94-b6da-c8b2a8fb3868,6647595d-50c1-4043-a220-0f5f2c6d7525,2cb6b053-969a-40a2-a054-223a2f3f11e1,Alexandre Morin,2024-10-03,Vers vague ton entretenir commun mur mon oser que soulever.,1.5,220,
4fd826b0-a525-40f8-8ec3-92670feeff76,6a0c1ae8-a761-407b-868f-a78dc2f8f267,99f39dfa-f1e2-4ec1-be06-d65859789f1f,Alexandre Traore,2025-06-15,Retrouver personne neuf passé demande mériter demande combat perdre.,0.5,220,
60cfe935-3a21-45f4-9024-c8d9fd2c32cc,7a68a2db-206c-463a-874c-ce554fc5103b,0ee105d0-7745-4c96-bbf0-3df65bd210ab,Marcel Leblanc,2025-02-13,Résister sien matin ensuite travailler disposer causer.,1.0,250,
a0ffe46b-125a-4c94-b699-b585005dcb09,d3be7f8e-fabe-4a9e-8b72-8663263a0655,4d1333a4-d0c7-4c36-9580-2a400135c126,Victor du Vasseur,2025-05-07,Quand source dame rire eaux trente morceau digne deux.,0.25,300,
a099b475-89dc-47c4-8fe2-e0f3c9ff7d75,3812653d-ee0c-4bf0-9e9c-5754d44c991b,99f39dfa-f1e2-4ec1-be06-d65859789f1f,Alexandre Traore,2025-04-25,Oncle projet condition honneur saison simplement haut considérer compagnon.,0.5,250,
15f66890-9019-460d-a106-3e9b8d95c7d2,9bec7d9b-ca21-4ce2-8f26-deaaccd0d787,2cb6b053-969a-40a2-a054-223a2f3f11e1,Alexandre Morin,2023-12-25,Aspect désert table intelligence mal lettre.,0.25,180,
96454466-b951-4e92-b595-5e136220de7a,8c64a9b1-2a6b-4d38-b2c4-27410cdcc6a5,4d1333a4-d0c7-4c36-9580-2a400135c126,Victor du Vasseur,2023-08-10,Juste supporter envelopper nation mince terme.,1.5,180,b18e2d3d-4fc4-4450-81a6-014f7a5cb413
c44dd30b-759d-4570-955a-18116ef409db,67e44cc0-3f78-4825-9c41-94aaa0d700ef,0ee105d0-7745-4c96-bbf0-3df65bd210ab,Marcel Leblanc,2023-11-24,Cher roi rang blond ressembler forme.,1.5,300,
c4296828-c0d1-4501-bdfe-f995926ec76f,2f9ffe63-1122-4a41-b385-0fc011fd3e91,52fc2f51-6484-441d-a3ac-19515cc8485f,Yves Traore,2025-07-09,Mener compagnie sourd discussion mien.,0.25,220,
776b854b-c8d5-4433-b280-b890684da510,e2f60e46-aea3-4c9f-ba95-63c857e667cd,0ee105d0-7745-4c96-bbf0-3df65bd210ab,Marcel Leblanc,2024-11-24,Lutte lisser montagne étranger creuser quartier près fauteuil lourd.,1.5,250,
840cc2cf-988d-4afc-a724-67bf5973b79a,2d1cc68c-c65a-4064-8718-47f4f9607871,2cb6b053-969a-40a2-a054-223a2f3f11e1,Alexandre Morin,2023-01-20,Parvenir fonder attendre secours raison vraiment regarder.,1.0,180,30d78438-add4-437d-8166-0df7d0092b8c
12d9805b-1c0f-4502-9c6d-edaad6ef3fe3,6e6176c0-f267-4ad2-b06f-cf818f9ceea1,d0be7ecc-0745-4454-a3cc-2d2868b6b3d8,Aurore Maury-Briand,2022-06-16,Douleur elle toile payer.,1.0,180,
44486b23-6b3b-45b1-9f08-4e4a21f7cd38,c07fb20c-e320-4e66-a10d-0e8a24c3b869,52fc2f51-6484-441d-a3ac-19515cc8485f,Yves Traore,2025-03-28,Siège mourir bureau auprès sec coeur creuser proposer surprendre sol.,1.0,180,
d212a306-3706-469c-b058-a924fb15a8d0,fa87aa0d-a900-46bf-8e1b-056cd4c896ce,d0be7ecc-0745-4454-a3cc-2d2868b6b3d8,Aurore Maury-Briand,2021-11-27,Patron combien toucher trembler race pièce.,2.0,180,fa161c15-1e0f-44d2-9fd1-ac151e7898c5
12c9d32c-5b0e-4816-9242-16343fa3b4f0,df65f114-c111-4815-a52e-37c3cf451607,57bf8456-f58d-41c6-afc3-2e24e3b187b4,Gabriel de Guilbert,2024-09-06,Coucher douceur sol longtemps asseoir saint temps.,0.25,250,
b7aaaaeb-041a-4d77-9cdb-1328a476cea4,9292307a-94a6-40fe-82a9-f9c8f9b2e743,495caabb-57b9-4f6c-a1a0-256d5fc15acf,Denis-Franck Ledoux,2024-01-22,Voler baisser porte lever oh camarade former partager public.,1.0,250,
c7477db1-934c-41ad-a750-1f64ecb4457f,e2f60e46-aea3-4c9f-ba95-63c857e667cd,57bf8456-f58d-41c6-afc3-2e24e3b187b4,Gabriel de Guilbert,2022-10-23,Ciel soit tombe veille fuir rang.,0.5,250,
31170cdc-0268-4def-9e35-b9c123be8e38,32da7216-fddc-4c53-bb9f-79e5d7c19e0d,0ee105d0-7745-4c96-bbf0-3df65bd210ab,Marcel Leblanc,2023-09-29,Camarade rejoindre plein campagne fil.,2.0,180,
9f6047a8-5419-4bd4-bc49-6d3205f063bf,5ef07712-af0d-4cb3-b1e8-dea4a4580a29,2cb6b053-969a-40a2-a054-223a2f3f11e1,Alexandre Morin,2023-07-14,Tenir appeler oui an chair été.,2.0,220,
92ef48ea-9b22-4871-bf4e-59a24814a617,2d1cc68c-c65a-4064-8718-47f4f9607871,57bf8456-f58d-41c6-afc3-2e24e3b187b4,Gabriel de Guilbert,2025-06-05,Recherche toute couche papa protéger annoncer mort groupe essuyer mari.,1.0,220,
ad84c25a-6c97-485a-9cab-39c470d3a2fc,a7ff57e5-b6d5-45e4-94c5-9665832397ae,52fc2f51-6484-441d-a3ac-19515cc8485f,Yves Traore,2025-04-25,Île sortir rocher remplacer bouche réduire.,1.5,220,
fd1ed66f-8c51-4364-9505-e07501bf1b6b,478ddbef-c815-4bf6-b821-65f2bb0b6c0a,57bf8456-f58d-41c6-afc3-2e24e3b187b4,Gabriel de Guilbert,2024-04-15,Bois droite résister poitrine paraître changer.,0.5,300,14f95daf-f58a-4aa5-bd06-1524fae22415
a2c48976-34b4-4b36-a325-4c4a17c4e0a3,5eb7e4b2-59f0-4004-94ce-6723c90bd53e,52fc2f51-6484-441d-a3ac-19515cc8485f,Yves Traore,2024-11-13,Muet envelopper chacun nouveau.,0.5,220,
8e3a3a9a-4b29-4fff-9dd2-d17b9054be92,d50de8ff-16e9-4d43-9f15-b0b4160b3b75,2cb6b053-969a-40a2-a054-223a2f3f11e1,Alexandre Morin,2023-07-28,Âge saint conversation séparer vous étranger.,0.25,250,5e836c12-4453-4223-bd82-cc7f1076acda
6b083bfa-f1a5-4f63-a0e8-6f7f1d05ddea,383e47f4-9dc5-4c97-8959-a35de338f901,495caabb-57b9-4f6c-a1a0-256d5fc15acf,Denis-Franck Ledoux,2023-09-26,Robe qualité abandonner tout prière.,0.5,180,318e054d-41bb-4d87-8f64-9ab7f98169db
3400020f-233b-4ccb-95e0-0d75666d56d8,50e44b65-b025-44f1-a147-21356e86f3de,fba0cbe6-1a09-4487-946b-d85567269b04,Laurence Robert,2024-01-05,Étendue rendre nerveux saint remplacer découvrir ignorer chanter contenter traîner.,1.5,180,
1a0793ab-93e4-49a2-9aa9-92243c5fb6e5,93ad3a40-c852-43b8-af5e-7f8d608aba02,99f39dfa-f1e2-4ec1-be06-d65859789f1f,Alexandre Traore,2025-04-27,Faire employer tombe crier allumer trembler souvent rencontrer ajouter voiture.,2.0,180,
51297cf8-6512-4c75-815b-2a48aff1542c,35e0b91a-7738-44b0-9dc6-314af0111e05,a9f97ea4-2b30-4b38-a641-ccf0a35c99c1,Gérard-Frédéric Joly,2022-07-17,Ce oser jeter million douleur combat ouvrir heure produire.,0.25,180,903342cf-850f-4dd3-9cc2-360a53c87ea6
dec7ae42-2e5f-4b44-98c5-0c6283c4f406,dd66d9ff-2cb9-4001-b6ba-d50c6db32d2e,52fc2f51-6484-441d-a3ac-19515cc8485f,Yves Traore,2022-05-16,Grain nombreux fusil certain simple manier trois briser ensemble.,2.0,180,
254b401b-1ef7-4e18-be2c-aa57e8e0cef5,e2f60e46-aea3-4c9f-ba95-63c857e667cd,a9f97ea4-2b30-4b38-a641-ccf0a35c99c1,Gérard-Frédéric Joly,2022-12-29,Passion d'autres presser drôle désormais céder où te françois lentement tenter.,2.0,250,
0f7fd564-92f6-44ad-9174-2607f4862767,84735a55-224d-4cbf-b7e6-047615e4ccae,d0be7ecc-0745-4454-a3cc-2d2868b6b3d8,Aurore Maury-Briand,2024-07-13,Fait suivant en aucun heure plusieurs vue faute grâce.,0.5,300,
9a76674b-7a50-43b2-b776-2bee6b1adee9,c96ec555-0999-48ab-bfbb-b7d191d53cab,52fc2f51-6484-441d-a3ac-19515cc8485f,Yves Traore,2023-08-01,Dessus selon chaleur robe impression abri approcher.,1.0,250,
cd9aa5ee-9884-4ee1-8294-d9a959e34dee,50e44b65-b025-44f1-a147-21356e86f3de,99f39dfa-f1e2-4ec1-be06-d65859789f1f,Alexandre Traore,2021-11-05,Retomber lourd apparaître aller temps respirer.,2.0,250,
aa08c0fc-8486-45e4-af69-a807f7638857,e803fded-e227-45c0-86a9-41496eeceae3,99f39dfa-f1e2-4ec1-be06-d65859789f1f,Alexandre Traore,2024-10-09,Bois fort reculer beau classe lumière membre.,0.25,180,
fc2fe0f5-8219-493c-992f-82156eb254fd,ef2ffd82-d457-4b10-bfff-8555102f052e,0ee105d0-7745-4c96-bbf0-3df65bd210ab,Marcel Leblanc,2024-07-13,Roi plaisir honte chemin amour.,1.5,220,391799ef-beba-4a90-a78c-9bfb43481090
27d668f0-96fc-49d2-8ff5-acb64f25cef3,38e3550b-3272-4de0-ab86-e4d02923f1ad,d0be7ecc-0745-4454-a3cc-2d2868b6b3d8,Aurore Maury-Briand,2025-02-26,Vieux préparer indiquer corps apporter.,1.5,300,f5fbd5ab-08e4-4e9d-8924-14f3c3bb3ee2
fddbc35a-4037-4912-b367-b2fab278f755,d9d812c0-f98a-4596-a7f1-19c1be01c80c,d0be7ecc-0745-4454-a3cc-2d2868b6b3d8,Aurore Maury-Briand,2025-04-06,Désert impression décrire aventure argent.,1.5,180,
cf127874-8dcf-4aaf-88e2-ea74c213f17d,a4755241-8721-481d-b236-540d67589044,d0be7ecc-0745-4454-a3cc-2d2868b6b3d8,Aurore Maury-Briand,2025-04-14,Victime unique large couler fou calme côté âge.,0.25,250,
bc8bf9f8-92f4-4e09-aadc-103335745909,8d0dbdd2-2104-4733-8d39-000e977627c3,a9f97ea4-2b30-4b38-a641-ccf0a35c99c1,Gérard-Frédéric Joly,2025-03-24,Étranger silencieux plus honneur prendre nouveau.,1.0,180,
98c0a0f2-9311-402b-9b30-5234a88dd8be,7025280f-b901-4743-942f-5188308aa0f6,52fc2f51-6484-441d-a3ac-19515cc8485f,Yves Traore,2025-03-26,Cours miser espace yeux revenir.,1.5,250,
d6779c4f-6f0e-4ec3-9214-4958dfa117e2,c8986a69-d97e-4f85-a9a3-f1d85d927eb2,52fc2f51-6484-441d-a3ac-19515cc8485f,Yves Traore,2023-07-19,Franc saint théâtre haut deux hasard fond saint avenir neuf.,1.0,250,
71106be2-4768-49b6-8b05-0b0d0b8d0d76,ef2ffd82-d457-4b10-bfff-8555102f052e,2cb6b053-969a-40a2-a054-223a2f3f11e1,Alexandre Morin,2024-07-25,Sauvage précieux inviter an violent français grâce.,1.5,250,
39e8478c-1aeb-43e8-87c8-932ce59a18e5,89d0bf59-65aa-455e-93a9-d2c27c05e91d,99f39dfa-f1e2-4ec1-be06-d65859789f1f,Alexandre Traore,2024-10-03,Parcourir air aussi capable honneur jour instinct tenter.,0.5,220,
e56bcc5b-f8bf-4f39-b22e-c9e56f66ef0d,a2f8336d-9fa5-4feb-a147-9bea04d1b010,fba0cbe6-1a09-4487-946b-d85567269b04,Laurence Robert,2024-10-30,Race direction demain regarder.,1.5,180,35f02879-92f4-4149-b468-1adc2b39fce2
dfa85dbe-3334-40a0-a9fd-fa511fd32956,c07fb20c-e320-4e66-a10d-0e8a24c3b869,52fc2f51-6484-441d-a3ac-19515cc8485f,Yves Traore,2024-09-05,Ruine moi précipiter présent poussière.,0.25,250,
6a595be3-e7c4-4a66-9099-eb3eb5e32a80,d50de8ff-16e9-4d43-9f15-b0b4160b3b75,4d1333a4-d0c7-4c36-9580-2a400135c126,Victor du Vasseur,2024-05-31,Enfin plaindre présent engager.,1.0,250,
91f09acb-7d60-47fe-bd77-49b34ed714cf,edb86c4c-8504-4e7f-a82b-3185341de3b9,4d1333a4-d0c7-4c36-9580-2a400135c126,Victor du Vasseur,2024-10-26,Devant oiseau apercevoir nombre paysage.,2.0,250,efd4355d-37ac-4e20-9fd7-17ff1ff13932
bc4147ab-8f68-4182-ad41-3c7a9f44aa42,67e44cc0-3f78-4825-9c41-94aaa0d700ef,4d1333a4-d0c7-4c36-9580-2a400135c126,Victor du Vasseur,2025-05-28,Tourner force oeuvre voisin passage peau coucher nombreux politique.,2.0,300,
aa13cdcc-9047-4ae3-8aef-4ff5c30e61ec,a85698f6-489d-444f-b170-5483f65a5958,0ee105d0-7745-4c96-bbf0-3df65bd210ab,Marcel Leblanc,2025-05-28,Figurer militaire éclat fumée figurer boire curieux dur armée.,2.0,220,
59626027-770f-4a87-b372-f995ac9b918d,8a31273e-23eb-4904-b9df-c1fea644ed08,4d1333a4-d0c7-4c36-9580-2a400135c126,Victor du Vasseur,2024-01-22,Disparaître déjà compagnon entourer confondre quand vers plaisir nous nécessaire.,2.0,220,
e1026293-fd68-4a10-8f94-6ddd1474301b,2894aa01-a22f-4204-afd5-5ab69df9ca1a,57bf8456-f58d-41c6-afc3-2e24e3b187b4,Gabriel de Guilbert,2024-12-04,Homme affaire prétendre tempête colline gros voir petit aller instinct lui.,0.25,220,
eb73b4f2-4d00-406e-91fc-a2945866eed1,32da7216-fddc-4c53-bb9f-79e5d7c19e0d,57bf8456-f58d-41c6-afc3-2e24e3b187b4,Gabriel de Guilbert,2025-06-13,Bras fumée sein peu peser parmi.,2.0,300,
ea1b57b9-6d88-4643-9639-400778a20248,a4755241-8721-481d-b236-540d67589044,99f39dfa-f1e2-4ec1-be06-d65859789f1f,Alexandre Traore,2025-04-03,Service tâche même vieil bande.,1.0,250,
8fb1b85a-6a86-4eb7-aabe-d3787c1a649b,93ad3a40-c852-43b8-af5e-7f8d608aba02,2cb6b053-969a-40a2-a054-223a2f3f11e1,Alexandre Morin,2025-05-14,Mort nous sourire renoncer horizon chaud cabinet vif vent public marier.,1.5,220,
5b86ed19-7b74-46c6-98c2-f6bebb71dcee,b8423ed1-64a8-4af3-942b-18e0c7ce3226,4d1333a4-d0c7-4c36-9580-2a400135c126,Victor du Vasseur,2024-10-26,Vérité toujours loi rond seuil victime toujours sujet emmener champ.,0.5,220,
8dd4dfe7-15ba-4e8a-903f-dec026dab9f2,50c42b4c-6d85-4a6e-9d89-69c434cdb044,52fc2f51-6484-441d-a3ac-19515cc8485f,Yves Traore,2024-08-31,Trop sourd main quant à dehors visite vie faveur toute.,0.25,220,
b9f4dcb3-6e9e-4aa0-bcc7-9d9b7193e654,38e3550b-3272-4de0-ab86-e4d02923f1ad,4d1333a4-d0c7-4c36-9580-2a400135c126,Victor du Vasseur,2024-05-21,Attention ajouter matin genre ensuite place.,1.0,180,
d17497bf-c01c-43a7-a59e-22e9fe4bf1f1,8a31273e-23eb-4904-b9df-c1fea644ed08,a9f97ea4-2b30-4b38-a641-ccf0a35c99c1,Gérard-Frédéric Joly,2025-07-17,Semaine fidèle bas nous beauté peau.,1.5,220,b8e3e5b4-509f-4675-819a-428e761cb866
e36d740b-5b32-458e-b0ae-cd78c47ee732,33c2409d-4c78-4c01-829d-ec90310d94b2,a9f97ea4-2b30-4b38-a641-ccf0a35c99c1,Gérard-Frédéric Joly,2025-04-18,Long lever rouge docteur colline plan.,0.5,180,783aa2bf-7f24-4c9f-9043-24280e9c2ed9
51dbd654-5488-4fd5-9ab1-4ebb43a7c721,7025280f-b901-4743-942f-5188308aa0f6,52fc2f51-6484-441d-a3ac-19515cc8485f,Yves Traore,2025-04-20,Chercher promettre folie trésor plaisir sept pied arracher apprendre.,1.5,220,
005273a3-bb84-47dc-a0a2-d53ea6caf23f,11400748-cd6e-4a60-a8dc-b8ccfaf13cb7,fba0cbe6-1a09-4487-946b-d85567269b04,Laurence Robert,2025-01-18,Preuve dieu résoudre résoudre goutte éviter approcher.,1.5,250,
f54a0239-82d8-4084-8b50-83cb7554545e,bdbf9d61-f0d3-4b6f-8120-fe05a48d84c3,2cb6b053-969a-40a2-a054-223a2f3f11e1,Alexandre Morin,2025-06-28,Comprendre droite suivre possible mince espace fermer.,0.25,220,a899b2bf-6d13-45c5-9b06-57a4ad15546b
f23c1fff-07db-4c53-9b5d-5a9795c61d81,b3a3932e-0a68-41ff-898f-05d25f59b9a8,0ee105d0-7745-4c96-bbf0-3df65bd210ab,Marcel Leblanc,2023-02-14,Naturel silence perte passer confiance passé sourire tôt premier.,0.5,180,
221cda51-5c44-4d8e-a954-14ad2b3de1aa,c8986a69-d97e-4f85-a9a3-f1d85d927eb2,fba0cbe6-1a09-4487-946b-d85567269b04,Laurence Robert,2023-11-24,Ferme mémoire prochain traîner grave discuter lors cheveu hier chien est.,2.0,250,
f7516161-faf1-4170-8664-67f211054ff8,3812653d-ee0c-4bf0-9e9c-5754d44c991b,2cb6b053-969a-40a2-a054-223a2f3f11e1,Alexandre Morin,2023-07-05,Circonstance trace nation dernier parler dos.,0.5,300,
d7456434-ebbd-4c31-9182-2954242fdb31,3cf05f82-1e8a-4f73-a5ce-baf9dd9191b0,a9f97ea4-2b30-4b38-a641-ccf0a35c99c1,Gérard-Frédéric Joly,2024-12-14,À verser veille rencontrer discuter fortune.,2.0,300,
0618b44d-dee5-465f-8127-07a298ce0939,c43cfe86-737c-4c21-9a89-b9ea98543080,d0be7ecc-0745-4454-a3cc-2d2868b6b3d8,Aurore Maury-Briand,2024-11-07,Déclarer appel haine voici force cheveu voile mal observer.,1.5,180,
228baed2-7a60-4895-a86f-8f458faaafe3,676d8d9b-7605-46f5-bbff-22f0b7c81b28,0ee105d0-7745-4c96-bbf0-3df65bd210ab,Marcel Leblanc,2025-02-28,Aile savoir beau autrefois y calme supposer vouloir désigner.,2.0,180,
287d517b-53a8-4cf3-a639-e3a0e34417be,f8274b5f-57fb-4135-8047-e10f465da7a3,fba0cbe6-1a09-4487-946b-d85567269b04,Laurence Robert,2025-05-19,Passé coeur ruine cours froid dehors inviter froid à consentir.,1.0,300,
374b27c9-e740-4706-a964-c08637cc6d61,87d0ddf5-77c4-4f8c-84c0-1fc9ea226e41,99f39dfa-f1e2-4ec1-be06-d65859789f1f,Alexandre Traore,2023-10-25,Terrible entendre longtemps fou renoncer.,1.0,300,e3cc2e50-72e2-40f1-86ea-883645ff57dc
8f38b3fe-0bde-4260-b7a3-9ae3cbe08496,ef2ffd82-d457-4b10-bfff-8555102f052e,a9f97ea4-2b30-4b38-a641-ccf0a35c99c1,Gérard-Frédéric Joly,2025-04-24,Témoin expliquer vague raison.,1.0,250,07d22d01-a81e-4a28-a072-878f3ce7e660
12fcd9ce-2b4a-49f8-8c38-b787a1b7337a,6acbe356-09d4-4e5d-9784-e227ffdf336a,0ee105d0-7745-4c96-bbf0-3df65bd210ab,Marcel Leblanc,2024-12-14,Dire oublier grave pendant son pouvoir.,0.25,180,2fc43936-0ca7-4ff4-9766-8e37d3eeb374
f930db94-7006-497e-9da9-8af90a783a71,2a9a1ecf-1338-43b8-80c7-f3c79edbe83d,d0be7ecc-0745-4454-a3cc-2d2868b6b3d8,Aurore Maury-Briand,2023-11-15,Représenter gauche sentier intérêt quatre.,2.0,220,
d96b7122-af46-44a7-ba34-ee1a5856b4d0,b2bd2fa7-4177-4eef-801d-e4636cbfd6cb,d0be7ecc-0745-4454-a3cc-2d2868b6b3d8,Aurore Maury-Briand,2025-05-29,Relever cent dieu marquer rang.,1.0,180,
07258a17-822f-4602-857c-279db69222ff,12b5475b-3c3c-4686-bd19-efa37166d9be,99f39dfa-f1e2-4ec1-be06-d65859789f1f,Alexandre Traore,2024-12-01,Mémoire vague protéger soirée impression.,2.0,300,f1b867bb-7a02-4209-b03a-33a3cacf6c04
69ecd2d6-49cf-4521-8b1e-617fd07e17ee,7045eea4-e3d4-4c2a-85cd-15203afcc15d,2cb6b053-969a-40a2-a054-223a2f3f11e1,Alexandre Morin,2025-05-13,Blanc aventure doigt l'un voyage reprendre.,0.25,250,
78cb00f5-8a4e-4768-ad2a-e5cee22cb865,a7ff57e5-b6d5-45e4-94c5-9665832397ae,0ee105d0-7745-4c96-bbf0-3df65bd210ab,Marcel Leblanc,2024-08-09,Conscience fonder ferme discussion gloire phrase oui terme précéder naturellement poussière.,0.5,250,
64940d34-9e81-4774-b9c3-a3455c0ed145,9ac0a98a-83c1-44c7-a7c5-e133505b66ed,52fc2f51-6484-441d-a3ac-19515cc8485f,Yves Traore,2025-05-27,Endroit lit monde portier soit envie noire violence revenir.,0.25,250,
57ce4dd9-60c2-45d7-8d30-642d91c123df,3812653d-ee0c-4bf0-9e9c-5754d44c991b,a9f97ea4-2b30-4b38-a641-ccf0a35c99c1,Gérard-Frédéric Joly,2022-01-28,Ceci chaîne nuit conduire sentier.,2.0,220,b7294ce6-2762-4b8f-a88e-b9ed7092cd08
8c8e1402-e1d5-470b-aec1-1ef369c5e27d,a76e2480-dc6b-4d7a-89cf-cbc9848c15d2,495caabb-57b9-4f6c-a1a0-256d5fc15acf,Denis-Franck Ledoux,2025-05-11,Vous désert tour spectacle appuyer calme inventer gloire proposer.,0.25,250,3cb4d5e2-9900-4228-9587-ab5d5b2c04d2
1e1b80fd-461f-4388-9b76-1c3632d04b65,07b23f67-bf45-4c3e-a977-64df7e55f252,a9f97ea4-2b30-4b38-a641-ccf0a35c99c1,Gérard-Frédéric Joly,2024-03-18,Marquer rejoindre rien coûter enfermer fumée presque cela lueur différent.,0.25,220,
dda714be-56e0-4209-b061-c0ccb35eb037,33c2409d-4c78-4c01-829d-ec90310d94b2,52fc2f51-6484-441d-a3ac-19515cc8485f,Yves Traore,2025-06-13,Aspect jouer armée notre pénétrer élever chair manger nature conclure.,2.0,250,
da06cbfe-0eec-469c-8328-2391355bfeb4,9bec7d9b-ca21-4ce2-8f26-deaaccd0d787,57bf8456-f58d-41c6-afc3-2e24e3b187b4,Gabriel de Guilbert,2024-06-15,Y pointe dont taille situation ordre groupe fumée.,1.0,250,
71ef914d-df5f-4ca6-8d3f-ca62e4469762,10e7ec70-18c8-460f-9e8f-7d62a0687233,99f39dfa-f1e2-4ec1-be06-d65859789f1f,Alexandre Traore,2024-03-20,Dire adresser résoudre endormir goutte facile rapporter établir suite.,1.5,220,f37428b7-52da-4759-a1fc-89b1cb170d24
9fd530d5-882f-4230-9557-fa9fd1e1446b,89d0bf59-65aa-455e-93a9-d2c27c05e91d,52fc2f51-6484-441d-a3ac-19515cc8485f,Yves Traore,2025-04-23,Repas en ensemble dans renverser révolution amener certainement signe.,2.0,300,c00a5102-a937-4f67-aaff-11b62bbe9198
aaa64a35-6a6d-48f2-ae63-2107b033fd17,33c2409d-4c78-4c01-829d-ec90310d94b2,2cb6b053-969a-40a2-a054-223a2f3f11e1,Alexandre Morin,2025-06-12,Retrouver sorte répéter si connaître genre précis.,2.0,180,
28e59a49-a9f3-4b99-b846-702e741bf849,3ba4c7d7-5a41-486e-8bef-3fe7e7c59a05,57bf8456-f58d-41c6-afc3-2e24e3b187b4,Gabriel de Guilbert,2025-01-29,Forêt espèce oh découvrir art.,0.5,250,3374dbc8-1c15-4034-b784-dda20e7d50f0
8bb55eef-ffc3-4320-9add-f0f641ec1c9d,1b08e87f-ec7c-48b6-88e9-bfa9c62e2a81,57bf8456-f58d-41c6-afc3-2e24e3b187b4,Gabriel de Guilbert,2024-08-09,Clair considérer complet école ventre retour grandir soulever pourquoi.,1.0,180,25177a22-c849-42ef-8785-618fcc05f09e
21d84e40-b56e-4759-ae73-e3b6e2cc307a,5eb7e4b2-59f0-4004-94ce-6723c90bd53e,2cb6b053-969a-40a2-a054-223a2f3f11e1,Alexandre Morin,2025-01-06,Foule reculer ordre flot bouche comprendre président.,1.5,250,
03bc6807-7456-46d5-a82c-ea9f84c52e14,c96ec555-0999-48ab-bfbb-b7d191d53cab,52fc2f51-6484-441d-a3ac-19515cc8485f,Yves Traore,2023-04-11,Fauteuil vie lier vague marché.,0.25,300,2e8b2037-7ce4-4ce1-83e5-5b82f4b79b46
f71af2b5-e6f3-4b8a-a938-a73f7c6a861d,f4ae22ce-607d-429e-af02-92cb70ad5efb,4d1333a4-d0c7-4c36-9580-2a400135c126,Victor du Vasseur,2023-11-12,Votre accepter tandis que mariage brûler noire vision jeune.,2.0,220,
2aa7a2d2-69eb-4a64-85d7-6a8b2143e105,3baa46cb-83ff-46bb-9904-040db6558921,495caabb-57b9-4f6c-a1a0-256d5fc15acf,Denis-Franck Ledoux,2023-10-25,Centre songer commun nous trembler hier reposer admettre réveiller homme.,1.0,250,1cf91a03-8015-4505-8f34-d4f01d4ee8b3
44d73d41-071a-4773-9215-b62102700b22,ed2e758f-1b23-45bf-8701-decd93182ddb,fba0cbe6-1a09-4487-946b-d85567269b04,Laurence Robert,2025-02-12,Respirer seulement pas grâce chef ça colère courir.,1.0,180,
17827df2-3f60-4351-aa9b-19711f7ffe1e,50c42b4c-6d85-4a6e-9d89-69c434cdb044,d0be7ecc-0745-4454-a3cc-2d2868b6b3d8,Aurore Maury-Briand,2024-12-11,Pur sourire etc gris poussière protéger soirée.,2.0,180,352192b7-72cd-41e4-883f-450d68f03d06
182e09ec-b3e4-4252-ab5f-63916b12680d,4a35432a-d5f4-4f25-aed1-c11a4d72b6d6,4d1333a4-d0c7-4c36-9580-2a400135c126,Victor du Vasseur,2025-06-06,Impossible être route comme vite.,0.5,300,
a8d00824-529f-4626-9b95-614d50b6945d,99f0fbb9-d8d9-4ef2-b8be-ddab91aa33d8,4d1333a4-d0c7-4c36-9580-2a400135c126,Victor du Vasseur,2024-05-02,En ce million ramasser lieu souffler.,1.5,180,
608ef433-412d-44da-a751-ea5928018326,f8274b5f-57fb-4135-8047-e10f465da7a3,0ee105d0-7745-4c96-bbf0-3df65bd210ab,Marcel Leblanc,2025-01-23,Arbre plus grave empêcher fait pensée est.,1.5,180,0be6b2ce-ac6d-45b8-931f-f8cb147b8414
013889a2-32bd-461b-803b-be3e8670fbed,a7ff57e5-b6d5-45e4-94c5-9665832397ae,4d1333a4-d0c7-4c36-9580-2a400135c126,Victor du Vasseur,2024-03-22,Sentiment avant changement convenir train vivre.,0.5,300,
bc7b524e-097a-40b0-9db6-4625b6e046fe,9eb7c745-68f4-40bc-b8ad-2e733e75d5c6,57bf8456-f58d-41c6-afc3-2e24e3b187b4,Gabriel de Guilbert,2022-11-01,Oser qualité ville pointe pain rose bas haut religion réduire.,2.0,300,dd64bce5-7e35-4bf6-9d69-dec6e17f8464
85629d4a-44cd-4ccf-8086-78f57fb9b16f,852e0a6d-857f-468b-bcec-6f38a233264a,2cb6b053-969a-40a2-a054-223a2f3f11e1,Alexandre Morin,2024-06-17,Payer poche combat commencement contraire savoir masse.,1.5,180,
4b1526fa-98c7-48e5-bc2a-c483cfb1c9e5,435ed83c-bb7e-465c-b4aa-287d9d1e6957,52fc2f51-6484-441d-a3ac-19515cc8485f,Yves Traore,2025-01-21,Sur événement action meilleur rêve.,0.5,250,
47a7e88a-8ffe-4804-887a-cdd555d53201,5ef07712-af0d-4cb3-b1e8-dea4a4580a29,99f39dfa-f1e2-4ec1-be06-d65859789f1f,Alexandre Traore,2023-05-17,Répondre venir salut devant prévoir corde finir vouloir violence entrer.,1.0,300,
47c6a259-2ce5-4501-a0fc-42c8cb3d9c06,80feccbf-8f35-4dec-8a53-2ce879f745e3,99f39dfa-f1e2-4ec1-be06-d65859789f1f,Alexandre Traore,2025-05-18,Sauter disposer suivre époque décrire empêcher animer titre précipiter.,0.5,180,
24bc08ef-1716-467c-85ec-621b703c6051,c8986a69-d97e-4f85-a9a3-f1d85d927eb2,2cb6b053-969a-40a2-a054-223a2f3f11e1,Alexandre Morin,2025-05-23,Lueur prier forêt inventer dur.,1.0,220,348ec532-dbe6-4bb2-8681-3a5a0547e249
01e38bae-3012-47e8-ba2c-f473aaaa3800,11cb12b7-6500-4cf7-8cdf-0d93efb55921,4d1333a4-d0c7-4c36-9580-2a400135c126,Victor du Vasseur,2022-12-23,Étendue comment deux terre user dimanche grand saluer creuser.,0.25,250,
499f8e1e-3535-4ce0-b5b1-d5cc827ffa06,a59ce143-58b4-4d0f-aab8-c6fc169f1105,4d1333a4-d0c7-4c36-9580-2a400135c126,Victor du Vasseur,2024-12-17,Inviter ouvrir huit répondre briser.,2.0,220,
16401a26-4179-4e78-a5a2-f8dc0b318619,15ca8e8c-203a-4697-a48b-7fc01e16b255,52fc2f51-6484-441d-a3ac-19515cc8485f,Yves Traore,2025-06-13,Déposer nous chef imaginer lien peu son pur.,0.25,180,
6d4bfaea-33e7-4cab-8f3a-1fdd1955aa86,e5e5ae54-64f3-4a99-81d8-679c58d59672,57bf8456-f58d-41c6-afc3-2e24e3b187b4,Gabriel de Guilbert,2025-03-29,Monsieur grâce ni lueur choix souvenir posséder attendre votre enfermer naître.,1.0,220,f59e6f38-da8e-45ba-99da-a3573725720e
2422ecbd-b6af-410a-97c2-feebcf535c5f,edb86c4c-8504-4e7f-a82b-3185341de3b9,fba0cbe6-1a09-4487-946b-d85567269b04,Laurence Robert,2024-09-26,Branche secrétaire point deux dehors robe six voilà mauvais.,2.0,220,
71bedb77-d14d-4ccc-baa4-304d5834e576,478ddbef-c815-4bf6-b821-65f2bb0b6c0a,57bf8456-f58d-41c6-afc3-2e24e3b187b4,Gabriel de Guilbert,2024-09-16,Complet cerveau courant militaire début hôtel magnifique.,2.0,300,
ef1048e2-293d-4f71-9809-854821d3ac34,e6c15b83-4920-4ed7-b094-4fe8eeb78588,495caabb-57b9-4f6c-a1a0-256d5fc15acf,Denis-Franck Ledoux,2024-04-11,Respirer cheval cacher pays mentir ami théâtre ci soulever creuser.,0.5,180,
6b22d83b-0f85-43e8-b027-cc45d9af574f,8a31273e-23eb-4904-b9df-c1fea644ed08,495caabb-57b9-4f6c-a1a0-256d5fc15acf,Denis-Franck Ledoux,2022-10-01,Soit tomber prétendre mille crise chat appuyer car conscience complètement.,0.5,250,
cc991a8c-c747-46b5-ab02-4a7bc5e97572,9eb7c745-68f4-40bc-b8ad-2e733e75d5c6,99f39dfa-f1e2-4ec1-be06-d65859789f1f,Alexandre Traore,2021-08-18,Attitude main impossible feuille.,0.5,300,
8df1257d-7f65-4cc8-82f0-7f263e991190,f28715a5-6113-4310-944a-97fc62d6dcf8,57bf8456-f58d-41c6-afc3-2e24e3b187b4,Gabriel de Guilbert,2022-10-27,Livrer parole planche million réveiller.,0.25,300,3d7094d5-91b0-41a6-a579-23573e38b169
de39ae90-5f8f-4414-897d-9372620e3ff6,545b783a-2080-4167-ad84-2651e2342fb5,fba0cbe6-1a09-4487-946b-d85567269b04,Laurence Robert,2025-01-16,Cause menacer rouge contenir fille besoin attention projet.,0.5,300,
ccc1822e-1c32-4f8e-83cf-b6658d114776,8a31273e-23eb-4904-b9df-c1fea644ed08,a9f97ea4-2b30-4b38-a641-ccf0a35c99c1,Gérard-Frédéric Joly,2024-05-15,Tour pendant passer bas long argent joie.,0.25,220,
5b514830-2c0b-49fb-a7e4-249766198b11,8c64a9b1-2a6b-4d38-b2c4-27410cdcc6a5,4d1333a4-d0c7-4c36-9580-2a400135c126,Victor du Vasseur,2024-12-02,Passer corps en soirée noire savoir résoudre angoisse coucher religion.,2.0,220,
7a3e0b42-d6ee-4909-bc8c-01acc3302e58,2e469faf-03f8-44f4-b0c9-b787d01e2e0e,57bf8456-f58d-41c6-afc3-2e24e3b187b4,Gabriel de Guilbert,2024-04-26,Sec franchir confier fatigue rose trésor un noire hasard.,0.5,220,
